1333,JRC1,"Judicial review claim form - criminal injuries compensation cases, England and Wales",HMCTS,Form,English,03/2013,jrc1-eng.doc,DOC,Formfinder,Administrative Appeals Chamber (Upper Tribunal),#N/A,#N/A,none detected,938,3,0,1,1,0,Yes,0
1334,JRC1,"Judicial review claim form - criminal injuries compensation cases, England and Wales",HMCTS,Form,English,01/2012,jrc1-eng.pdf,PDF,Formfinder,Administrative Appeals Chamber (Upper Tribunal),55,41,none detected,785,3,0,1,1,0,Yes,0
382,JRC1 Notes,Information notes and guidance for completing claim form JRC1,HMCTS,Guidance,English,07/2012,jrc1-notes-eng.doc,DOC,Formfinder,Administrative Appeals Chamber (Upper Tribunal),30,22,"c(""jr1"", ""jrc1"")",N/A,#VALUE!,2,0,0,0,Yes,0
1335,Juror Charter,Juror Charter,HMCTS,Leaflet,English,08/2014,juror-charter-eng.pdf,PDF,Formfinder,Jury Service,81,80,none detected,N/A,#VALUE!,0,0,0,0,No,0
1336,Jury Summons Form,Jury summons form,HMCTS,Form,English,07/2014,jury-summons-form-eng.pdf,PDF,Formfinder,Jury Service,175,158,none detected,1763,6,0,0,1,0,No,0
1337,Jury Summons Guide,Guide to jury summons,HMCTS,Guidance,English,07/2017,jury-summons-guide-eng.pdf,PDF,Formfinder,Jury Service,61,54,none detected,N/A,#VALUE!,0,0,0,0,No,0
2229,345961,L17: statement of earnings,LAA,Form,English,NA,L7-_statement_of_earnings.pdf,PDF,GOV.UK,NA,4176,NA,NULL,#N/A,#N/A,NA,NA,1,0,Yes,NA
2086,345728,CIV ADMIN1: claim for preservation/recovery under statutory charge,LAA,Form,English,NA,laa-civadmin1-version-12-august-2014.pdf,PDF,GOV.UK,NA,1068,NA,NULL,#N/A,#N/A,NA,NA,1,0,Yes,NA
2093,345570,CIV APP8A: application for prior authority/change (cost limitation),LAA,Form,English,NA,laa-civapp8a-version-4-8-2014.pdf,PDF,GOV.UK,NA,684,NA,NULL,#N/A,#N/A,NA,NA,1,0,Yes,NA
2113,346079,"CIV MEANS 1: financial assessment form, not passported",LAA,Form,English,NA,laa-civmeans1-version-17-8-2014.pdf,PDF,GOV.UK,NA,5436,NA,NULL,#N/A,#N/A,NA,NA,1,1,Yes,NA
2248,346217,"Mental health: CLR, enhanced rates and review of refusal",LAA,Form,English,NA,laa-cw1and2mh-version-10-8-2014.pdf,PDF,GOV.UK,NA,1404,NA,NULL,#N/A,#N/A,NA,NA,1,0,No,NA
2156,346256,CW3: extension of upper cost limit in controlled work cases,LAA,Form,English,NA,laa-cw3-version-6-8-2014.pdf,PDF,GOV.UK,NA,408,NA,NULL,#N/A,#N/A,NA,NA,1,0,No,NA
2222,346249,"CW2 (IMM) for representation, disbursement limit extension (CW3C), review of refusal (CW4): immigration forms",LAA,Form,English,NA,laa-cw4-version-10-8-2014.pdf,PDF,GOV.UK,NA,1248,NA,NULL,#N/A,#N/A,NA,NA,1,0,No,NA
2249,346219,"Mental health: CLR, enhanced rates and review of refusal",LAA,Form,English,NA,laa-cwc-mental-health-version-4-8-2014.pdf,PDF,GOV.UK,NA,96,NA,NULL,#N/A,#N/A,NA,NA,1,0,No,NA
2253,345586,"Notices: certificate, extension/amendment and withdrawal/revocation",LAA,Form,English,NA,laa-notice-of-extension-version-3-8-2014.pdf,PDF,GOV.UK,NA,600,NA,NULL,#N/A,#N/A,NA,NA,1,0,No,NA
2252,345581,"Notices: certificate, extension/amendment and withdrawal/revocation",LAA,Form,English,NA,laa-notice-of-issue-version3-8-2014.pdf,PDF,GOV.UK,NA,3324,NA,NULL,#N/A,#N/A,NA,NA,1,0,No,NA
2254,345588,"Notices: certificate, extension/amendment and withdrawal/revocation",LAA,Form,English,NA,laa-notice-of-withdrawal-version-3-8-2014.pdf,PDF,GOV.UK,NA,1032,NA,NULL,#N/A,#N/A,NA,NA,1,0,No,NA
2232,604155,LAC1: committal form for directed Crown Court cases,LAA,Guidance,English,NA,lac1-guidance-v3.pdf,PDF,GOV.UK,NA,156,NA,NULL,N/A,#VALUE!,NA,NA,1,0,No,NA
2177,421694,Family Graduated Fee and Family Advocacy claim forms,LAA,Guidance,English,NA,lc5-laa-assessed-claim5-fgf-checklist.pdf,PDF,GOV.UK,NA,264,NA,NULL,N/A,#VALUE!,NA,NA,1,0,Yes,NA
2179,421695,Family Graduated Fee and Family Advocacy claim forms,LAA,Other,English,NA,lc5a-laa-assessed-claim5-fas-checklist.pdf,PDF,GOV.UK,NA,576,NA,NULL,N/A,#VALUE!,NA,NA,1,0,Yes,NA
267,Leasehold 1,Application for a determination as to liability to pay an administration charge or for the variation of a fixed administration charge,HMCTS,Form,English,04/2017,leasehold-1-eng.doc,DOC,Formfinder,Residential Property (First-tier Tribunal),255,224,"c(""ex160"", ""cb1"", ""ex160a"")",3297,10,3,0,1,0,Yes,1
180,Leasehold 10,Application for determination of the terms of acquisition remaining in dispute. Flats and premises (Collective enfranchisement),HMCTS,Form,English,01/2017,leasehold-10-eng.doc,DOC,Formfinder,Residential Property (First-tier Tribunal),224,188,"c(""ex160"", ""cb1"", ""leasehold 8"", ""ex160a"")",2853,9,4,0,1,0,Yes,1
181,Leasehold 11,Application for determination of premium or other terms of acquisition remaining in dispute. Flats and premises (Lease renewal),HMCTS,Form,English,01/2017,leasehold-11-eng.doc,DOC,Formfinder,Residential Property (First-tier Tribunal),858,698,"c(""ex160"", ""cb1"", ""leasehold 8"", ""ex160a"")",3162,10,4,0,1,0,Yes,1
268,Leasehold 12,Application for determination of price payable. houses and premises (Leasehold enfranchisement),HMCTS,Form,English,01/2017,leasehold-12-eng.doc,DOC,Formfinder,Residential Property (First-tier Tribunal),206,169,"c(""ex160"", ""cb1"", ""ex160a"")",3593,11,3,0,1,0,Yes,1
588,Leasehold 13,"Applications for determination of price payable, provisions in the conveyance, apportionment of rent and determination of sub-tenant's share. Houses and premises - Leasehold enfranchisement (Missing landlord)",HMCTS,Form,English,01/2017,leasehold-13-eng.doc,DOC,Formfinder,Residential Property (First-tier Tribunal),47,43,cb1,2918,9,1,0,1,0,Yes,1
589,Leasehold 14,Application for a Reasonable Costs Order,HMCTS,Form,English,01/2017,leasehold-14-eng.doc,DOC,Formfinder,Residential Property (First-tier Tribunal),185,165,cb1,3075,10,1,0,1,0,Yes,1
590,Leasehold 15,Application form: Flats and premises collective enfranchisement (Missing landlord),HMCTS,Form,English,01/2017,leasehold-15-eng.doc,DOC,Formfinder,Residential Property (First-tier Tribunal),34,30,cb1,2118,7,1,0,1,0,Yes,1
591,Leasehold 1a,Application for an order under paragraph 5A to schedule 11 of the Commonhold and Leasehold Reform Act 2002,HMCTS,Form,English,04/2017,leasehold-1a-eng.doc,DOC,Formfinder,Residential Property (First-tier Tribunal),64,57,cb1,2005,7,1,0,1,0,Yes,1
182,Leasehold 2,Application by a tenant for the appointment of a manager or for the variation or discharge of an order appointing a manager,HMCTS,Form,English,01/2017,leasehold-2-eng.doc,DOC,Formfinder,Residential Property (First-tier Tribunal),150,123,"c(""ex160"", ""cb1"", ""leasehold 7"", ""ex160a"")",3172,10,4,0,1,0,Yes,1
269,Leasehold 3,Application for a determination of liability to pay and reasonableness of service charges,HMCTS,Form,English,04/2017,leasehold-3-eng.doc,DOC,Formfinder,Residential Property (First-tier Tribunal),992,835,"c(""ex160"", ""cb1"", ""ex160a"")",3349,11,3,0,1,0,Yes,1
183,Leasehold 4,Application for the variation of a lease or leases,HMCTS,Form,English,01/2017,leasehold-4-eng.doc,DOC,Formfinder,Residential Property (First-tier Tribunal),234,202,"c(""ex160"", ""cb1"", ""leasehold 7"", ""ex160a"")",2886,9,4,0,1,0,Yes,1
270,Leasehold 5,Application for the dispensation of all or any of the consultation requirements provided for by Section 20 of the Landlord and Tenant Act 1985,HMCTS,Form,English,01/2017,leasehold-5-eng.doc,DOC,Formfinder,Residential Property (First-tier Tribunal),334,277,"c(""ex160"", ""cb1"", ""ex160a"")",2817,9,3,0,1,0,No,1
184,Leasehold 6,Application for an order that a breach of covenant or a condition in the lease has occurred,HMCTS,Form,English,01/2017,leasehold-6-eng.doc,DOC,Formfinder,Residential Property (First-tier Tribunal),400,329,"c(""ex160"", ""cb1"", ""leasehold 1"", ""ex160a"")",2465,8,4,0,1,0,Yes,1
592,Leasehold 7,Application for an order under Section 20C of the Landlord and Tenant Act 1985,HMCTS,Form,English,01/2017,leasehold-7-eng.doc,DOC,Formfinder,Residential Property (First-tier Tribunal),201,172,cb1,2082,7,1,0,1,0,Yes,1
593,Leasehold 8,"Application for determination of reasonable costs - Flats and Premises (Section 91(2)(d) of the Leasehold Reform, Housing and Urban Development Act 1993)",HMCTS,Form,English,01/2017,leasehold-8-eng.doc,DOC,Formfinder,Residential Property (First-tier Tribunal),311,266,cb1,2398,8,1,0,1,0,Yes,1
594,Leasehold 9,Application form: Flats and premises leasehold enfranchisement (Missing landlord lease terms and/or premium),HMCTS,Form,English,01/2017,leasehold-9-eng.doc,DOC,Formfinder,Residential Property (First-tier Tribunal),201,179,cb1,2144,7,1,0,1,0,Yes,1
2035,612165,Request leave for restricted patients,HMPPS,Form,English,NA,leave-application-restricted-patients1.docx,application/vnd.openxmlformats-officedocument.wordprocessingml.document,GOV.UK,NA,0,NA,NULL,#N/A,#N/A,NA,NA,1,0,No,NA
2134,375177,CRM14: criminal legal aid application form,LAA,Form,English,NA,legal-ad-crm15.pdf,PDF,GOV.UK,NA,11028,NA,NULL,#N/A,#N/A,NA,NA,1,0,Yes,NA
2046,345761,AF2: advocate graduated fee redetermination form,LAA,Form,English,NA,legal-aid-advocate-fee-redetermination.pdf,PDF,GOV.UK,NA,972,NA,NULL,#N/A,#N/A,NA,NA,1,0,No,NA
2044,345759,AF1: claim for advocate graduated fees,LAA,Guidance,English,NA,legal-aid-af1-checklist.pdf,PDF,GOV.UK,NA,564,NA,NULL,N/A,#VALUE!,NA,NA,1,0,Yes,NA
2045,345760,AF1: claim for advocate graduated fees,LAA,Guidance,English,NA,legal-aid-af1-guidance.pdf,PDF,GOV.UK,NA,744,NA,NULL,N/A,#VALUE!,NA,NA,1,0,Yes,NA
2237,454837,Legal aid: exceptional case funding form and guidance,LAA,Guidance,English,NA,legal-aid-chancellor-inquests.pdf,PDF,GOV.UK,NA,1320,NA,NULL,N/A,#VALUE!,NA,NA,0,0,No,NA
2238,477317,Legal aid: exceptional case funding form and guidance,LAA,Guidance,English,NA,legal-aid-chancellor-non-inquests.pdf,PDF,GOV.UK,NA,1932,NA,NULL,N/A,#VALUE!,NA,NA,0,0,No,NA
2096,345557,CIV APP8: application for amendment/prior authority (civil),LAA,Guidance,English,NA,legal-aid-civ-app-8-guidance.pdf,PDF,GOV.UK,NA,684,NA,NULL,N/A,#VALUE!,NA,NA,1,0,No,NA
2094,345573,CIV APP8A: application for prior authority/change (cost limitation),LAA,Guidance,English,NA,legal-aid-civ-app-8a-guidance.pdf,PDF,GOV.UK,NA,288,NA,NULL,N/A,#VALUE!,NA,NA,1,0,Yes,NA
2115,346080,"CIV MEANS 1: financial assessment form, not passported",LAA,Guidance,English,NA,legal-aid-civ-means-1-guidance-2014__1_.pdf,PDF,GOV.UK,NA,1008,NA,NULL,N/A,#VALUE!,NA,NA,1,0,Yes,NA
2110,397072,CIV MEANS 1A: self-employed sole trader,LAA,Form,English,NA,legal-aid-civ-means-1a.pdf,PDF,GOV.UK,NA,936,NA,NULL,#N/A,#N/A,NA,NA,1,0,Yes,NA
2111,397080,CIV MEANS 1B: trading in a self-employed partnership,LAA,Form,English,NA,legal-aid-civ-means-1b.pdf,PDF,GOV.UK,NA,168,NA,NULL,#N/A,#N/A,NA,NA,1,0,Yes,NA
2112,397082,CIV MEANS 1C: company director or a shareholder in a limited company,LAA,Form,English,NA,legal-aid-civ-means-1c.pdf,PDF,GOV.UK,NA,444,NA,NULL,#N/A,#N/A,NA,NA,1,0,Yes,NA
2114,346084,"CIV MEANS 1: financial assessment form, not passported",LAA,Form,English,NA,legal-aid-civ-means-1P.pdf,PDF,GOV.UK,NA,828,NA,NULL,#N/A,#N/A,NA,NA,1,0,No,NA
2175,345692,Family Graduated Fee and Family Advocacy claim forms,LAA,Guidance,English,NA,legal-aid-civil-claim5-checklist.pdf,PDF,GOV.UK,NA,288,NA,NULL,N/A,#VALUE!,NA,NA,0,0,No,NA
2155,346200,CW1 PL: family help (lower) public law,LAA,Form,English,NA,legal-aid-controlled-work-1-public-law.pdf,PDF,GOV.UK,NA,5304,NA,NULL,#N/A,#N/A,NA,NA,1,0,No,NA
2154,346196,CW1: financial eligibility for legal aid clients,LAA,Form,English,NA,legal-aid-controlled-work-1.pdf,PDF,GOV.UK,NA,18372,NA,NULL,#N/A,#N/A,NA,NA,1,0,No,NA
2221,346246,"CW2 (IMM) for representation, disbursement limit extension (CW3C), review of refusal (CW4): immigration forms",LAA,Form,English,NA,legal-aid-controlled-work-2-immigration.pdf,PDF,GOV.UK,NA,5088,NA,NULL,#N/A,#N/A,NA,NA,1,0,Yes,NA
2163,346272,CW5: financial eligibility form for clients wanting family mediation,LAA,Form,English,NA,legal-aid-controlled-work-5.pdf,PDF,GOV.UK,NA,864,NA,NULL,#N/A,#N/A,NA,NA,1,0,No,NA
2250,346223,"Mental health: CLR, enhanced rates and review of refusal",LAA,Form,English,NA,legal-aid-controlled-work-mental-health-review.pdf,PDF,GOV.UK,NA,132,NA,NULL,#N/A,#N/A,NA,NA,1,0,Yes,NA
2172,345697,Family Graduated Fee and Family Advocacy claim forms,LAA,Form,English,NA,legal-aid-counsel-family-claims-receipt-form.doc,DOC,GOV.UK,NA,156,NA,NULL,#N/A,#N/A,NA,NA,0,0,No,NA
2133,302306,CRM14: criminal legal aid application form,LAA,Form,English,NA,legal-aid-CRM1.pdf,PDF,GOV.UK,NA,5412,NA,NULL,#N/A,#N/A,NA,NA,0,0,No,NA
2140,345849,CRM10: apply for review of refusal or withdrawal of Advocacy Assistance,LAA,Form,English,NA,legal-aid-CRM10.pdf,PDF,GOV.UK,NA,240,NA,NULL,#N/A,#N/A,NA,NA,1,0,No,NA
2141,346432,CRM11: generic costs claim sheet,LAA,Form,English,NA,legal-aid-crm11-cost-summary.pdf,PDF,GOV.UK,NA,2376,NA,NULL,#N/A,#N/A,NA,NA,0,0,No,NA
2135,375178,CRM14: criminal legal aid application form,LAA,Form,English,NA,legal-aid-crm15c.pdf,PDF,GOV.UK,NA,2304,NA,NULL,#N/A,#N/A,NA,NA,0,0,No,NA
2144,345743,CRM16: review on the grounds of hardship,LAA,Guidance,English,NA,legal-aid-crm16-guidance.pdf,PDF,GOV.UK,NA,2412,NA,NULL,N/A,#VALUE!,NA,NA,1,0,No,NA
2143,375181,CRM16: review on the grounds of hardship,LAA,Form,English,NA,legal-aid-crm16.pdf,PDF,GOV.UK,NA,5448,NA,NULL,#N/A,#N/A,NA,NA,1,0,No,NA
2146,345811,CRM18: escape fee case claim form (crime),LAA,Form,English,NA,legal-aid-crm18-escape-fee-claim.pdf,PDF,GOV.UK,NA,708,NA,NULL,#N/A,#N/A,NA,NA,1,0,Yes,NA
2147,345813,CRM18: escape fee case claim form (crime),LAA,Guidance,English,NA,legal-aid-crm18a-guidance.pdf,PDF,GOV.UK,NA,348,NA,NULL,N/A,#VALUE!,NA,NA,1,0,No,NA
2150,345845,CRM3: apply for advocacy assistance,LAA,Form,English,NA,legal-aid-CRM3.pdf,PDF,GOV.UK,NA,2784,NA,NULL,#N/A,#N/A,NA,NA,1,0,No,NA
2153,346635,CRM8: assigned counsel's fee note,LAA,Form,English,NA,legal-aid-crm8-assigned-counsel.pdf,PDF,GOV.UK,NA,684,NA,NULL,#N/A,#N/A,NA,NA,1,0,No,NA
2136,375272,CRM14: criminal legal aid application form,LAA,Form,English,NA,legal-aid-declaration-criminal-online.pdf,PDF,GOV.UK,NA,9984,NA,NULL,#N/A,#N/A,NA,NA,1,0,No,NA
2091,345515,CIV APP3: application for legal aid in family proceedings,LAA,Guidance,English,NA,legal-aid-evidence-for-private-family-law-matters.pdf,PDF,GOV.UK,NA,3696,NA,NULL,N/A,#VALUE!,NA,NA,0,1,No,NA
2176,345693,Family Graduated Fee and Family Advocacy claim forms,LAA,Guidance,English,NA,legal-aid-ex504.pdf,PDF,GOV.UK,NA,504,NA,NULL,N/A,#VALUE!,NA,NA,1,0,No,NA
2171,345694,Family Graduated Fee and Family Advocacy claim forms,LAA,Form,English,NA,legal-aid-ex505.pdf,PDF,GOV.UK,NA,180,NA,NULL,#N/A,#N/A,NA,NA,1,0,No,NA
2244,345732,LF1: claim litigator fees,LAA,Form,English,NA,legal-aid-fixed-fee-claim.pdf,PDF,GOV.UK,NA,2676,NA,NULL,#N/A,#N/A,NA,NA,1,0,Yes,NA
2242,345726,LF1: claim litigator fees,LAA,Form,English,NA,legal-aid-graduated-fee-claim-form.pdf,PDF,GOV.UK,NA,7356,NA,NULL,#N/A,#N/A,NA,NA,1,0,Yes,NA
2243,345730,LF1: claim litigator fees,LAA,Form,English,NA,legal-aid-graduated-fee-claim-online.pdf,PDF,GOV.UK,NA,2052,NA,NULL,#N/A,#N/A,NA,NA,0,0,Yes,NA
2257,541637,Personal guarantee and indemnity,LAA,Form,English,NA,legal-aid-guarantee-indemnity-deed-agreement.docx,application/vnd.openxmlformats-officedocument.wordprocessingml.document,GOV.UK,NA,1788,NA,NULL,#N/A,#N/A,NA,NA,1,0,No,NA
2138,302293,CRM14: criminal legal aid application form,LAA,Guidance,English,NA,legal-aid-guidance-CRM14-and-CRM15.pdf,PDF,GOV.UK,NA,4104,NA,NULL,N/A,#VALUE!,NA,NA,1,0,No,NA
2152,345765,CRM7: non-standard fee magistrates' court claim and appeal form,LAA,Guidance,English,NA,legal-aid-guidance-for-reporting-crime-lower-work.pdf,PDF,GOV.UK,NA,1872,NA,NULL,N/A,#VALUE!,NA,NA,1,0,No,NA
2139,302297,CRM14: criminal legal aid application form,LAA,Guidance,English,NA,legal-aid-historic-DCA-rates-and-areas.pdf,PDF,GOV.UK,NA,420,NA,NULL,N/A,#VALUE!,NA,NA,0,0,No,NA
2215,345082,Housing Possession Court Duty Schemes (HPCDS),LAA,Form,English,NA,legal-aid-hpcds-client-monitoring-form.docx,application/vnd.openxmlformats-officedocument.wordprocessingml.document,GOV.UK,NA,624,NA,NULL,#N/A,#N/A,NA,NA,0,0,No,NA
2219,345078,Housing Possession Court Duty Schemes (HPCDS),LAA,Guidance,English,NA,legal-aid-hpcds-guidance.pdf,PDF,GOV.UK,NA,540,NA,NULL,N/A,#VALUE!,NA,NA,1,0,No,NA
2255,541635,Personal guarantee and indemnity,LAA,Form,English,NA,legal-aid-indemnity_forms-limited-liability-partnerships.docx,application/vnd.openxmlformats-officedocument.wordprocessingml.document,GOV.UK,NA,744,NA,NULL,#N/A,#N/A,NA,NA,1,0,No,NA
2256,541636,Personal guarantee and indemnity,LAA,Form,English,NA,legal-aid-indemnity-limited-companies.docx,application/vnd.openxmlformats-officedocument.wordprocessingml.document,GOV.UK,NA,1020,NA,NULL,#N/A,#N/A,NA,NA,1,0,No,NA
2245,345738,LF1: claim litigator fees,LAA,Form,English,NA,legal-aid-interim-claim.pdf,PDF,GOV.UK,NA,2124,NA,NULL,#N/A,#N/A,NA,NA,1,0,Yes,NA
2053,345852,Apply for judicial apportionment of costs,LAA,Form,English,NA,legal-aid-judicial-apportionment.pdf,PDF,GOV.UK,NA,588,NA,NULL,#N/A,#N/A,NA,NA,1,0,No,NA
2227,418492,Judicial review discretion pro forma,LAA,Guidance,English,NA,legal-aid-judicial-review-guidance.pdf,PDF,GOV.UK,NA,264,NA,NULL,N/A,#VALUE!,NA,NA,1,0,No,NA
2228,418019,Judicial review discretion pro forma,LAA,Other,English,NA,legal-aid-judicial-review.docx,application/vnd.openxmlformats-officedocument.wordprocessingml.document,GOV.UK,NA,684,NA,NULL,N/A,#VALUE!,NA,NA,1,0,No,NA
2231,345829,LAC1: committal form for directed Crown Court cases,LAA,Form,English,NA,legal-aid-lac1-committal_form.pdf,PDF,GOV.UK,NA,1200,NA,NULL,#N/A,#N/A,NA,NA,1,0,No,NA
2247,345757,LF2: apply for a litigator fee review,LAA,Form,English,NA,legal-aid-litigator-fee-review.pdf,PDF,GOV.UK,NA,3204,NA,NULL,#N/A,#N/A,NA,NA,1,0,No,NA
2124,345682,CIV POA1: payment on account of claim,LAA,Guidance,English,NA,legal-aid-poa-checklist.pdf,PDF,GOV.UK,NA,504,NA,NULL,N/A,#VALUE!,NA,NA,1,0,No,NA
2108,424938,Civil claims rates calculator,LAA,Guidance,English,NA,legal-aid-rates-calculator-guidance.pdf,PDF,GOV.UK,NA,1140,NA,NULL,N/A,#VALUE!,NA,NA,1,0,No,NA
2241,345735,Legal aid representative nomination form,LAA,Form,English,NA,legal-aid-representative-nomination.pdf,PDF,GOV.UK,NA,216,NA,NULL,#N/A,#N/A,NA,NA,1,0,No,NA
2261,604157,LF3: apply for an interim litigator fee claim,LAA,Form,English,NA,lf3-offline-v.2-october-2016.pdf,PDF,GOV.UK,NA,156,NA,NULL,#N/A,#N/A,NA,NA,1,0,Yes,NA
2260,604156,LF3: apply for an interim litigator fee claim,LAA,Form,English,NA,lf3-online-v3-october-2016.pdf,PDF,GOV.UK,NA,96,NA,NULL,#N/A,#N/A,NA,NA,0,0,Yes,NA
2259,354074,LF3A: apply for a litigator fee final claim where an interim fee has been paid,LAA,Form,English,NA,lf3a-offline-version-1-august-2014.pdf,PDF,GOV.UK,NA,252,NA,NULL,#N/A,#N/A,NA,NA,1,0,Yes,NA
2258,354073,LF3A: apply for a litigator fee final claim where an interim fee has been paid,LAA,Form,English,NA,lf3a-online-version-1-august-2014.pdf,PDF,GOV.UK,NA,180,NA,NULL,#N/A,#N/A,NA,NA,0,0,Yes,NA
2246,513208,LF1: claim litigator fees,LAA,Form,English,NA,litigator-fee-special-preparation-claim-form.pdf,PDF,GOV.UK,NA,1032,NA,NULL,#N/A,#N/A,NA,NA,1,0,Yes,NA
595,LOC002,I Want to challenge the outcome of an election and how do I apply for relief,HMCTS,Leaflet,English,08/2014,loc002-eng.pdf,PDF,Formfinder,Queen's Bench,1,1,n244,N/A,#VALUE!,1,0,1,0,Yes,0
1338,LOC006,Bankruptcy Court guide,HMCTS,Guidance,English,11/2013,loc006-eng.pdf,PDF,Formfinder,Bankruptcy and Insolvency,216,198,none detected,N/A,#VALUE!,0,0,0,0,No,0
1339,LOC009,I wish to apply to extend time for Registration of a Charge or to rectify a mis-statement or omission (in the Registered Particulars of a Charge or of a Memorandum of Satisfaction),HMCTS,Form,English,01/2013,loc009-eng.pdf,PDF,Formfinder,Bankruptcy and Insolvency,725,628,none detected,692,3,0,0,1,0,No,1
1340,LOC010,I wish to apply to rescind a winding up order. What do I do?,HMCTS,Form,English,04/2011,loc010-eng.pdf,PDF,Formfinder,Bankruptcy and Insolvency,106,94,none detected,535,2,0,0,0,0,No,0
1341,LOC013,I wish to apply for my cert of discharge,HMCTS,Form,English,03/2014,loc013-eng.doc,DOC,Formfinder,Bankruptcy and Insolvency,629,518,none detected,453,2,0,0,1,0,No,0
383,LOC014,Court fees for bankrupts,HMCTS,Form,English,12/2008,loc014-eng.pdf,PDF,Formfinder,Fees and Help with Fees,96,92,"c(""ex160"", ""ex160a"")",187,1,2,0,0,0,No,0
1342,LOC040,Royal Courts of Justice Family Video Conferencing Booking Request,HMCTS,Form,English,02/2011,loc040-eng.doc,DOC,Formfinder,Family,14,10,none detected,366,2,0,0,1,0,No,0
1343,LOC045,Model directions for clinical negligence cases (2012) - before Master Roberts and Master Cook,HMCTS,Leaflet,English,08/2015,loc045-eng.doc,DOC,Formfinder,Queen's Bench,8,8,none detected,N/A,#VALUE!,0,0,1,0,No,0
2364,603367,Gwneud atwrneiaeth arhosol,OPG,Guidance,English,NA,LP12-Gwneud-a-chofrestru-eich-atwrneiaeth-arhosol-canllawiau.pdf,PDF,GOV.UK,NA,60,NA,NULL,N/A,#VALUE!,NA,NA,0,0,No,NA
2378,603364,Lasting power of attorney forms,OPG,Guidance,English,NA,LP12-Make-and-register-your-lasting-power-of-attorney-a-guide.pdf,PDF,GOV.UK,NA,5076,NA,NULL,N/A,#VALUE!,NA,NA,1,1,No,NA
2332,601524,Cofrestru atwrneiaeth arhosol,OPG,Form,English,NA,LP13-Cofrestru-eich-atwrneiaeth-arhosol-canllawiau.pdf,PDF,GOV.UK,NA,24,NA,NULL,#N/A,#N/A,NA,NA,0,0,No,NA
2359,601149,Gwneud atwrneiaeth arhosol,OPG,Form,English,NA,LP1F-Atwrneiaeth-arhosol-penderfyniadau-ariannol.pdf,PDF,GOV.UK,NA,24,NA,NULL,#N/A,#N/A,NA,NA,1,0,No,NA
2372,600963,Lasting power of attorney forms,OPG,Form,English,NA,LP1F-Create-and-register-your-lasting-power-of-attorney.pdf,PDF,GOV.UK,NA,168,NA,NULL,#N/A,#N/A,NA,NA,1,0,No,NA
2360,601152,Gwneud atwrneiaeth arhosol,OPG,Form,English,NA,LP1H-atwrneiaeth-arhosol-Penderfyniadau-ynglyn-ag-iechyd-a-lles.pdf,PDF,GOV.UK,NA,24,NA,NULL,#N/A,#N/A,NA,NA,1,0,No,NA
2373,600964,Lasting power of attorney forms,OPG,Form,English,NA,LP1H-Create-and-register-your-lasting-power-of-attorney.pdf,PDF,GOV.UK,NA,72,NA,NULL,#N/A,#N/A,NA,NA,1,0,No,NA
2333,601525,Cofrestru atwrneiaeth arhosol,OPG,Form,English,NA,LP2-Cofrestru-eich-atwrneiaeth-arhosol.pdf,PDF,GOV.UK,NA,0,NA,NULL,#N/A,#N/A,NA,NA,0,0,No,NA
2388,600972,Register a lasting power of attorney,OPG,Form,English,NA,LP2-Register-your-lasting-power-of-attorney.pdf,PDF,GOV.UK,NA,1488,NA,NULL,#N/A,#N/A,NA,NA,1,0,Yes,NA
2331,562213,Cofrestru atwrneiaeth arhosol,OPG,Form,English,NA,LP3-Ffurflen-hysbysu-pobl.pdf,PDF,GOV.UK,NA,48,NA,NULL,#N/A,#N/A,NA,NA,0,0,No,NA
2358,562213,Gwneud atwrneiaeth arhosol,OPG,Form,English,NA,LP3-Ffurflen-hysbysu-pobl.pdf,PDF,GOV.UK,NA,60,NA,NULL,#N/A,#N/A,NA,NA,0,0,No,NA
2370,514409,Lasting power of attorney forms,OPG,Form,English,NA,LP3-Form-to-notify-people.pdf,PDF,GOV.UK,NA,15708,NA,NULL,#N/A,#N/A,NA,NA,0,0,No,NA
2386,514409,Register a lasting power of attorney,OPG,Form,English,NA,LP3-Form-to-notify-people.pdf,PDF,GOV.UK,NA,2352,NA,NULL,#N/A,#N/A,NA,NA,0,0,No,NA
1344,LPA 008,Notice to the Office of the Public Guardian of an application to object to registration of a lasting power of attorney made to the Court of Protection,HMCTS,Form,English,09/2011,lpa-008-eng.pdf,PDF,Formfinder,Court of Protection,89,82,none detected,11,1,0,0,0,0,No,0
2362,603370,Gwneud atwrneiaeth arhosol,OPG,Form,English,NA,LPA-ar-gyfer-eiddo-a-materion-ariannol.zip,ZIP,GOV.UK,NA,36,NA,NULL,#N/A,#N/A,NA,NA,0,0,No,NA
2363,603374,Gwneud atwrneiaeth arhosol,OPG,Form,English,NA,LPA-ar-gyfer-iechyd-a-lles.zip,ZIP,GOV.UK,NA,0,NA,NULL,#N/A,#N/A,NA,NA,0,0,No,NA
2375,603362,Lasting power of attorney forms,OPG,Form,English,NA,LPA-for-financial-decisions-make-and-register-complete-pack.zip,ZIP,GOV.UK,NA,37092,NA,NULL,#N/A,#N/A,NA,NA,0,0,No,NA
2379,606038,Lasting power of attorney forms,OPG,Guidance,English,NA,LPA-for-financial-decisions-make-and-register-large-print.zip,ZIP,GOV.UK,NA,2484,NA,NULL,N/A,#VALUE!,NA,NA,0,0,No,NA
2376,603363,Lasting power of attorney forms,OPG,Form,English,NA,LPA-for-health-and-care-decisions-make-and-register-complete-pack.zip,ZIP,GOV.UK,NA,13728,NA,NULL,#N/A,#N/A,NA,NA,0,0,No,NA
2377,606040,Lasting power of attorney forms,OPG,Form,English,NA,LPA-for-health-and-care-decisions-make-and-register-large-print.zip,ZIP,GOV.UK,NA,960,NA,NULL,#N/A,#N/A,NA,NA,0,0,No,NA
2353,440363,Disclaim a lasting power of attorney,OPG,Form,English,NA,LPA005_disclaimer_web_0715.pdf,PDF,GOV.UK,NA,4164,NA,NULL,#N/A,#N/A,NA,NA,1,0,No,NA
2369,562367,Ildio atwrneiaeth arhosol,OPG,Form,English,NA,LPA005-Ymwrthodiad-gan-atwrnai-arfaethedig-neu-atwrnai-dros-dro-o-dan-atwrneiaeth-arhosol.pdf,PDF,GOV.UK,NA,36,NA,NULL,#N/A,#N/A,NA,NA,0,0,No,NA
2365,562108,Gwrthwynebu cofrestru atwrneiaeth,OPG,Form,English,NA,LPA006-Gwrthwynebiad-gan-y-rhoddwr-i-gofrestru_r-atwrneiaeth-arhosol.pdf,PDF,GOV.UK,NA,48,NA,NULL,#N/A,#N/A,NA,NA,1,0,No,NA
2383,604125,Object to registration of a power of attorney,OPG,Form,English,NA,LPA006-Objection-by-the-donor-to-the-registration-of-a-lasting-power-of-attorney.pdf,PDF,GOV.UK,NA,252,NA,NULL,#N/A,#N/A,NA,NA,1,0,No,NA
2366,562109,Gwrthwynebu cofrestru atwrneiaeth,OPG,Form,English,NA,LPA007-Gwrthwynebiad-i-Swyddfa_r-Gwarcheidwad-Cyhoeddus-ynglyn-a-chofrestru-arfaethedig-atwrneiaeth-arhosol-ar-seiliau-ffeithiol.pdf,PDF,GOV.UK,NA,36,NA,NULL,#N/A,#N/A,NA,NA,1,0,Yes,NA
2380,566046,Object to registration of a power of attorney,OPG,Form,English,NA,LPA007-Object-to-registration-of-LPA-factual-grounds_.pdf,PDF,GOV.UK,NA,1536,NA,NULL,#N/A,#N/A,NA,NA,1,0,Yes,NA
2368,585345,Gwrthwynebu cofrestru atwrneiaeth,OPG,Form,English,NA,LPA008-Hysbysiad-i-OPG-am-gais-i-wrthwynebu-cofrestru-LPA-a-gyflwynwyd-ir-Llys-Gwarchod.pdf,PDF,GOV.UK,NA,36,NA,NULL,#N/A,#N/A,NA,NA,0,0,No,NA
2382,566048,Object to registration of a power of attorney,OPG,Form,English,NA,LPA008-Object-to-registration-of-LPA-notify-OPG_.pdf,PDF,GOV.UK,NA,1464,NA,NULL,#N/A,#N/A,NA,NA,1,0,No,NA
2400,397043,Search Public Guardian registers,OPG,Guidance,English,NA,LPA109_Office_of_the_Public_Guardian_Registers_guidance.pdf,PDF,GOV.UK,NA,4044,NA,NULL,N/A,#VALUE!,NA,NA,0,0,No,NA
