652,N9(CC),Acknowledgment of Service,HMCTS,Form,English,04/2011,n9(cc)-eng.pdf,PDF,Formfinder,Commercial Court,1231,1060,n9,188,1,1,0,1,0,No,0
1611,N9(CCCH),Acknowledgment of Service - Chancery Division Financial List,HMCTS,Form,English,10/2015,n9(ccch)-eng.pdf,PDF,Formfinder,Chancery,75,69,n9,193,1,0,0,1,0,No,0
654,N9(CCFL),Acknowledgment of Service - Commercial Court Financial List,HMCTS,Form,English,10/2015,n9(ccfl)-eng.pdf,PDF,Formfinder,Commercial Court,54,43,n9,197,1,1,0,1,0,No,0
1612,N92,Cais am orchymyn gweinyddu / Application for an administration order,HMCTS,Form,Welsh,04/2006,n92-bil.pdf,PDF,Formfinder,County Court,#N/A,#N/A,none detected,0,0,0,1,0,0,No,0
655,N92,Application for an Administration Order,HMCTS,Form,English,04/2006,n92-eng.pdf,PDF,Formfinder,County Court,928,818,n270,681,3,1,1,1,0,No,0
1614,N93,Rhestr Credydwyr / List of creditors,HMCTS,Form,Welsh,04/1999,n93-bil.pdf,PDF,Formfinder,County Court,#N/A,#N/A,none detected,7,1,0,0,0,0,No,0
1613,N93,List of creditors furnished under the Act of 1971,HMCTS,Form,English,04/1999,n93-eng.pdf,PDF,Formfinder,County Court,12,12,none detected,320,1,0,0,0,0,No,0
1615,N9A,Ffurflen addefiad (swm penodol) / Form of admission (Specified amount),HMCTS,Form,Welsh,04/2006,n9a-bil.pdf,PDF,Formfinder,County Court,#N/A,#N/A,none detected,0,0,0,2,0,0,No,0
656,N9A,Form of admission (Specified Amount),HMCTS,Form,English,04/2014,n9a-eng.pdf,PDF,Formfinder,County Court,3851,3380,n9b,740,3,1,2,1,0,No,0
1617,N9B,Amddiffyniad a Gwrth-hawliad (swm penodol) / Defence and counterclaim (Specified amount),HMCTS,Form,Welsh,04/2008,n9b-bil.pdf,PDF,Formfinder,County Court,1,1,none detected,80,1,0,6,0,0,Yes,0
1616,N9B,Defence / Counterclaim (Specified amount),HMCTS,Form,English,04/2013,n9b-eng.pdf,PDF,Formfinder,County Court,5850,5153,none detected,153,1,0,6,1,0,Yes,0
1619,N9C,"Addefiad (swm amhenodol,hawliadau anariannol a dychwelyd nwyddau) / Admission (Unspecified amount, non-money and return of goods claims)",HMCTS,Form,Welsh,04/2006,n9c-bil.pdf,PDF,Formfinder,County Court,#N/A,#N/A,none detected,0,0,0,4,0,0,No,0
1618,N9C,Admission (unspecified amount and non-money claims),HMCTS,Form,English,04/2006,n9c-eng.pdf,PDF,Formfinder,County Court,2124,1744,none detected,246,1,0,4,1,0,No,0
1621,N9D,"Amddiffyniad a Gwrth-hawliad (symiau amhenodol, hawliadau anari-annol a dychwelyd nwyddau) / Defence and counterclaim (Unspecified amount, non-money and return of goods claim)",HMCTS,Form,Welsh,04/2008,n9d-bil.pdf,PDF,Formfinder,County Court,#N/A,#N/A,none detected,36,1,0,5,0,0,No,0
1620,N9D,Defence / Counterclaim (Unspecified amount and non-money claims),HMCTS,Form,English,04/2008,n9d-eng.pdf,PDF,Formfinder,County Court,2426,2059,none detected,30,1,0,5,0,0,No,0
1622,No.100,Notice of Bail (sched.1- RSC O.79 r.9(7)),HMCTS,Form,English,04/2005,no.100-eng.doc,DOC,Formfinder,Queen's Bench,16,14,NULL,#N/A,#N/A,0,0,0,0,No,0
1623,No.109,Order for reference to the European Court (Sched 1- RSC O.114 r.2),HMCTS,Form,English,04/2005,no.109-eng.doc,DOC,Formfinder,Queen's Bench,12,7,NULL,#N/A,#N/A,0,0,0,0,No,0
1624,No.32,Order for examination within jurisdiction of witness before trial or hearing (rule 34.8),HMCTS,Form,English,04/2016,no.32-eng.doc,DOC,Formfinder,Queen's Bench,7,7,NULL,#N/A,#N/A,0,0,0,0,No,0
1625,No.33,Application for an order for the issue of a letter of request to judicial authorities out of the jurisdiction (rule 34.13 and PD34A para 5),HMCTS,Form,English,04/2016,no.33-eng.doc,DOC,Formfinder,Queen's Bench,5,4,NULL,#N/A,#N/A,0,0,0,0,No,0
1626,No.34,Order for the issue of a letter of request to judicial authorities out of the jurisdiction (rule 34.13),HMCTS,Form,English,04/2016,no.34-eng.doc,DOC,Formfinder,Queen's Bench,6,4,NULL,#N/A,#N/A,0,0,0,0,No,0
1627,No.35,Draft Letter of request for examination of witness out of jurisdiction (to be filed by a party under rule 34.13(6)),HMCTS,Form,English,04/2016,no.35-eng.doc,DOC,Formfinder,Queen's Bench,5,4,NULL,#N/A,#N/A,0,0,0,0,No,0
1628,No.37,Order for appointment of special examiner to take evidence of witness out of jurisdiction (rule 34.13(4) and PD34A para 5.8),HMCTS,Form,English,04/2016,no.37-eng.doc,DOC,Formfinder,Queen's Bench,6,5,NULL,#N/A,#N/A,0,0,0,0,No,0
1629,No.41,Default judgment upon request in claim relating to detention of goods (rule 12.4(1)(c)),HMCTS,Form,English,04/2016,no.41-eng.doc,DOC,Formfinder,Queen's Bench,13,11,NULL,#N/A,#N/A,0,0,0,0,No,0
1630,No.42,Default judgment in claim for possession of land (rule 12.4(2)(a)),HMCTS,Form,English,04/2005,no.42-eng.doc,DOC,Formfinder,Queen's Bench,29,19,NULL,#N/A,#N/A,0,0,0,0,No,0
1631,No.42A,Order for possession (sched.1- RSC O.113),HMCTS,Form,English,04/2005,no.42a-eng.doc,DOC,Formfinder,Queen's Bench,92,62,NULL,#N/A,#N/A,0,0,0,0,No,0
1632,No.44,Part 24 - Judgment for claimant,HMCTS,Form,English,04/2016,no.44-eng.doc,DOC,Formfinder,Queen's Bench,41,29,NULL,#N/A,#N/A,0,0,0,0,No,0
1633,No.44A,Part 24 - Judgment for defendant,HMCTS,Form,English,04/2016,no.44a-eng.doc,DOC,Formfinder,Queen's Bench,27,22,NULL,#N/A,#N/A,0,0,0,0,No,0
1634,No.44B,Order under refusing judgment under Part 24 and giving directions as to the future conduct of the case,HMCTS,Form,English,04/2016,no.44b-eng.doc,DOC,Formfinder,Queen's Bench,3,3,NULL,#N/A,#N/A,0,0,0,0,No,0
1635,No.44C,Order under Part 24 imposing condition of payment into court (rule 3.1(3) and PD 24 paras 5.1 and 5.2),HMCTS,Form,English,04/2016,no.44c-eng.doc,DOC,Formfinder,Queen's Bench,3,3,NULL,#N/A,#N/A,0,0,0,0,No,0
1636,No.44D,Order under Part 24 for detailed assessment of solicitor's bill of costs and for judgment on the amount found due thereunder,HMCTS,Form,English,04/2016,no.44d-eng.doc,DOC,Formfinder,Queen's Bench,12,10,NULL,#N/A,#N/A,0,0,0,0,No,0
1637,No.45,Judgment after trial before Judge without jury (Practice Direction 40B para 14.1(1)),HMCTS,Form,English,04/2016,no.45-eng.doc,DOC,Formfinder,Queen's Bench,20,18,NULL,#N/A,#N/A,0,0,0,0,No,0
1638,No.46,Judgment after trial before Judge with jury (Practice Direction 40B para 14.1(2)),HMCTS,Form,English,04/2016,no.46-eng.doc,DOC,Formfinder,Queen's Bench,3,3,NULL,#N/A,#N/A,0,0,0,0,No,0
1639,No.47,Judgment after trial before a Master or District Judge (PD40B para 14),HMCTS,Form,English,04/2016,no.47-eng.doc,DOC,Formfinder,Queen's Bench,13,8,NULL,#N/A,#N/A,0,0,0,0,No,0
1640,No.48,Order after separate trial of issue under rule 3.1(2)(i),HMCTS,Form,English,04/2016,no.48-eng.doc,DOC,Formfinder,Queen's Bench,2,2,NULL,#N/A,#N/A,0,0,0,0,No,0
1641,No.49,Judgment against personal representative (PD40B para 14.3),HMCTS,Form,English,04/2016,no.49-eng.doc,DOC,Formfinder,Queen's Bench,2,2,NULL,#N/A,#N/A,0,0,0,0,No,0
1642,No.52,Notice of claim to non-parties (CPR 19.8A(4)(a)(i)),HMCTS,Form,English,04/2016,no.52-eng.doc,DOC,Formfinder,Queen's Bench,42,34,NULL,#N/A,#N/A,0,0,0,0,No,0
1643,No.52A,Notice of Judgment or Order to non-parties (CPR 19.8(4)(a)(i)),HMCTS,Form,English,04/2016,no.52a-eng.doc,DOC,Formfinder,Queen's Bench,12,11,NULL,#N/A,#N/A,0,0,0,0,No,0
1644,No.53,Writ of Control,HMCTS,Form,English,04/2014,no.53-eng.doc,DOC,Formfinder,Queen's Bench,1032,645,NULL,#N/A,#N/A,0,0,0,0,No,0
1645,No.54,Writ of Control on order for costs,HMCTS,Form,English,04/2014,no.54-eng.doc,DOC,Formfinder,Queen's Bench,72,58,NULL,#N/A,#N/A,0,0,0,0,No,0
1646,No.56,Writ of Control (For part),HMCTS,Form,English,04/2014,no.56-eng.doc,DOC,Formfinder,Queen's Bench,9,8,NULL,#N/A,#N/A,0,0,0,0,No,0
1647,No.57,Writ of Control against personal representative,HMCTS,Form,English,04/2014,no.57-eng.doc,DOC,Formfinder,Queen's Bench,7,7,NULL,#N/A,#N/A,0,0,0,0,No,0
1648,No.58,Writ of Fieri Facias de Bonis Ecclesiasticis (sched.1- RSC O.45 r.12),HMCTS,Form,English,04/2005,no.58-eng.doc,DOC,Formfinder,Queen's Bench,14,10,NULL,#N/A,#N/A,0,0,0,0,No,0
1649,No.59,Writ of Sequestrari de Bonis Ecclesiasticis (sched.1- RSC O.45 r.12),HMCTS,Form,English,04/2005,no.59-eng.doc,DOC,Formfinder,Queen's Bench,2,2,NULL,#N/A,#N/A,0,0,0,0,No,0
1650,No.62,Writ of Fieri Facias to enforce Northern Irish or Scottish judgment,HMCTS,Form,English,04/2004,no.62-eng.doc,DOC,Formfinder,Queen's Bench,39,28,NULL,#N/A,#N/A,0,0,0,0,No,0
1651,No.63,Writ of Control to enforce foreign registered judgment,HMCTS,Form,English,04/2014,no.63-eng.doc,DOC,Formfinder,Queen's Bench,21,16,NULL,#N/A,#N/A,0,0,0,0,No,0
1652,No.64,"Writ of Delivery: delivery of goods, damages and costs",HMCTS,Form,English,04/2014,no.64-eng.doc,DOC,Formfinder,Queen's Bench,21,17,NULL,#N/A,#N/A,0,0,0,0,No,0
1653,No.65,Writ of Delivery: delivery of goods or value damages and costs,HMCTS,Form,English,04/2004,no.65-eng.doc,DOC,Formfinder,Queen's Bench,6,6,NULL,#N/A,#N/A,0,1,0,0,No,0
1654,No.66,Combined Writ of Possession and Control,HMCTS,Form,English,04/2014,no.66-eng.doc,DOC,Formfinder,Queen's Bench,258,211,NULL,#N/A,#N/A,0,0,0,0,No,0
1655,No.66a,Combined Writ of Possession and Control for costs of action,HMCTS,Form,English,04/2014,no.66a-eng.doc,DOC,Formfinder,Queen's Bench,57,51,NULL,#N/A,#N/A,0,0,0,0,No,0
1656,No.67,Writ of sequestration (rule 81.20(1) and rule 81.27),HMCTS,Form,English,04/2016,no.67-eng.doc,DOC,Formfinder,Queen's Bench,21,21,NULL,#N/A,#N/A,0,0,0,0,No,0
1657,No.68,Writ of restitution,HMCTS,Form,English,04/2004,no.68-eng.doc,DOC,Formfinder,Queen's Bench,49,36,NULL,#N/A,#N/A,0,0,0,0,No,0
1658,No.69,Writ of Assistance,HMCTS,Form,English,04/2004,no.69-eng.doc,DOC,Formfinder,Queen's Bench,21,17,NULL,#N/A,#N/A,0,0,0,0,No,0
1659,No.71,Notice of extension of Writ of Control,HMCTS,Form,English,04/2014,no.71-eng.doc,DOC,Formfinder,Queen's Bench,9,9,NULL,#N/A,#N/A,0,0,0,0,No,0
1660,No.75,"Charging Order to show cause (sched. 1- RSC O.50 rr.1,2 and 4)",HMCTS,Form,English,04/2005,no.75-eng.doc,DOC,Formfinder,Queen's Bench,12,6,NULL,#N/A,#N/A,0,0,0,0,No,0
1661,No.76,Charging Order absolute (sched. 1- RSC O.50 rr.3 and 4),HMCTS,Form,English,04/2005,no.76-eng.doc,DOC,Formfinder,Queen's Bench,6,5,NULL,#N/A,#N/A,0,0,0,0,No,0
1662,No.79,Stop order on capital and income of funds in court (sched. 1- RSC O.50 r.10),HMCTS,Form,English,04/2005,no.79-eng.doc,DOC,Formfinder,Queen's Bench,11,9,NULL,#N/A,#N/A,0,0,0,0,No,0
1663,No.80,Affidavit / witness statement And stop notice (sched 1- RSC O.50 r.11),HMCTS,Form,English,04/2005,no.80-eng.doc,DOC,Formfinder,Queen's Bench,67,55,NULL,#N/A,#N/A,0,0,0,0,No,0
1664,No.81,Order on claim to restrain transfer of stock (sched 1- RSC O.50 r.15),HMCTS,Form,English,04/2005,no.81-eng.doc,DOC,Formfinder,Queen's Bench,1,1,NULL,#N/A,#N/A,0,0,0,0,No,0
1665,No.82,Application for appointment of a receiver (sched. 1- RSC O.51 r.3),HMCTS,Form,English,09/2000,no.82-eng.pdf,PDF,Formfinder,Queen's Bench,#N/A,#N/A,NULL,#N/A,#N/A,0,0,0,0,No,0
1666,No.83,Order directing application for appointment of receiver and granting injunction meanwhile (sched. 1- RSC O.51 r.3),HMCTS,Form,English,04/2005,no.83-eng.doc,DOC,Formfinder,Queen's Bench,32,19,NULL,#N/A,#N/A,0,0,0,0,No,0
1667,No.84,Order appointing receiver by way of equitable execution (Supreme Court Act 1981 s.37; sched. 1- RSC O.51),HMCTS,Form,English,04/2005,no.84-eng.doc,DOC,Formfinder,Queen's Bench,7,3,NULL,#N/A,#N/A,0,0,0,0,No,0
1668,No.85,Order of committal or other penalty upon finding of contempt of court (sched. 1- RSC O.52),HMCTS,Form,English,04/2005,no.85-eng.doc,DOC,Formfinder,Queen's Bench,158,97,NULL,#N/A,#N/A,0,0,0,0,No,0
1669,No.93,Order under the evidence (Proceedings in other jurisdictions) Act 1975 (sched. 1- RSC O.70 r.1),HMCTS,Form,English,04/2005,no.93-eng.doc,DOC,Formfinder,Queen's Bench,10,9,NULL,#N/A,#N/A,0,0,0,0,No,0
1670,No.94,Order for production of documents in marine insurance claim (Part 49D PD para. 7),HMCTS,Form,English,04/2005,no.94-eng.doc,DOC,Formfinder,Queen's Bench,3,1,NULL,#N/A,#N/A,0,0,0,0,No,0
1671,No.95,Certificate of Order against the Crown (sched. 1- RSC O.77 r.15 and s.25 of the Crown Proceedings Act 1947),HMCTS,Form,English,04/2005,no.95-eng.doc,DOC,Formfinder,Queen's Bench,12,4,NULL,#N/A,#N/A,0,0,0,0,No,0
1672,No.96,Certificate of Order for costs against the Crown (sched. 1- RSC O.77 r.15 and s.25 of the Crown Proceedings Act 1947),HMCTS,Form,English,04/2005,no.96-eng.doc,DOC,Formfinder,Queen's Bench,4,4,NULL,#N/A,#N/A,0,0,0,0,No,0
1673,No.97,Claim form to grant bail (criminal proceedings) (sched.1- RSC O.79 r.9(1)),HMCTS,Form,English,09/2000,no.97-eng.pdf,PDF,Formfinder,Queen's Bench,9,9,NULL,#N/A,#N/A,0,0,0,0,No,0
1674,No.97A,Claim form to vary arrangements for bail (criminal proceedings) (sched.1- RSC O.79 r.9(1)),HMCTS,Form,English,04/2005,no.97a-eng.doc,DOC,Formfinder,Queen's Bench,11,9,NULL,#N/A,#N/A,0,0,0,0,No,0
1675,No.98,Order to release prisoner on bail (sched.1- RSC O.79 r.9(6) (6A) and (6B)),HMCTS,Form,English,04/2005,no.98-eng.doc,DOC,Formfinder,Queen's Bench,9,6,NULL,#N/A,#N/A,0,0,0,0,No,0
1676,No.98A,Order varying arrangements for bail (sched.1- RSC O.79 r.9(10)),HMCTS,Form,English,04/2005,no.98a-eng.doc,DOC,Formfinder,Queen's Bench,13,10,NULL,#N/A,#N/A,0,0,0,0,No,0
1677,No.99,Order of Court of Appeal to admit prisoner to bail (sched. 1- RSC O.59 r.20(5)),HMCTS,Form,English,04/2005,no.99-eng.doc,DOC,Formfinder,Queen's Bench,1,1,NULL,#N/A,#N/A,0,0,0,0,No,0
2233,445594,Legal aid: exceptional case funding form and guidance,LAA,Form,English,NA,notice-director-legal-aid-case-work.pdf,PDF,GOV.UK,NA,360,NA,NULL,#N/A,#N/A,NA,NA,1,0,No,NA
1678,Notice of Intention to Pursue an Appeal,Notice of intention to pursue an appeal (UTIAC),HMCTS,Form,English,11/2013,notice-of-intention-to-pursue-an-appeal-eng.pdf,PDF,Formfinder,Immigration and Asylum Chamber (Upper Tribunal),160,144,none detected,431,2,0,0,1,0,Yes,0
2205,404131,Get proof that a partner has been charged with child abuse,LAA,Guidance,English,NA,ongoing-criminal-proceed-child-abuse-evidence__1_.doc,DOC,GOV.UK,NA,144,NA,NULL,N/A,#VALUE!,NA,NA,1,0,No,NA
2206,408932,Get proof that a partner has been charged with domestic violence,LAA,Form,English,NA,ongoing-criminal-proceedings-evidence.doc,DOC,GOV.UK,NA,96,NA,NULL,#N/A,#N/A,NA,NA,1,0,No,NA
2399,286541,Search Public Guardian registers,OPG,Form,English,NA,OPG100_Apply_to_search_PG_registers.pdf,PDF,GOV.UK,NA,26844,NA,NULL,#N/A,#N/A,NA,NA,0,0,No,NA
2330,562368,Chwilio drwy gofrestrau’r Gwarcheidwad Cyhoeddus,OPG,Form,English,NA,OPG100-Cais-i-chwilio-cofrestri_r-Gwarcheidwad-Cyhoeddus.pdf,PDF,GOV.UK,NA,36,NA,NULL,#N/A,#N/A,NA,NA,0,0,No,NA
2348,613985,Deputy annual report: accounting for your actions,OPG,Form,English,NA,OPG102-and-OPG102A-large-print.zip,ZIP,GOV.UK,NA,0,NA,NULL,#N/A,#N/A,NA,NA,0,0,No,NA
2345,562761,Deputy annual report: accounting for your actions,OPG,Form,English,NA,OPG102-Deputy-report-form-property-and-financial-decisions.pdf,PDF,GOV.UK,NA,5760,NA,NULL,#N/A,#N/A,NA,NA,1,0,No,NA
2349,537790,Deputy annual report: accounting for your actions,OPG,Guidance,English,NA,OPG102A-Filling-in-your-deputy-report-form-property-and-financial-decisions.pdf,PDF,GOV.UK,NA,2280,NA,NULL,N/A,#VALUE!,NA,NA,1,1,No,NA
2346,612605,Deputy annual report: accounting for your actions,OPG,Form,English,NA,OPG103-and-OPG103A-large-print.zip,ZIP,GOV.UK,NA,0,NA,NULL,#N/A,#N/A,NA,NA,0,0,No,NA
2341,537791,Deputy annual report: accounting for your actions,OPG,Form,English,NA,OPG103-Deputy-report-form-property-and-financial-decisions.pdf,PDF,GOV.UK,NA,2232,NA,NULL,#N/A,#N/A,NA,NA,1,0,No,NA
2350,537792,Deputy annual report: accounting for your actions,OPG,Guidance,English,NA,OPG103A-Filling-in-your-deputy-report-form-property-and-financial-decisions.pdf,PDF,GOV.UK,NA,876,NA,NULL,N/A,#VALUE!,NA,NA,1,0,No,NA
2347,612606,Deputy annual report: accounting for your actions,OPG,Form,English,NA,OPG104-and-OPG104A-large-print.zip,ZIP,GOV.UK,NA,0,NA,NULL,#N/A,#N/A,NA,NA,0,0,No,NA
2342,537794,Deputy annual report: accounting for your actions,OPG,Form,English,NA,OPG104-Deputy-report-form-health-and-welfare-decisions.pdf,PDF,GOV.UK,NA,468,NA,NULL,#N/A,#N/A,NA,NA,1,0,No,NA
2351,537795,Deputy annual report: accounting for your actions,OPG,Guidance,English,NA,OPG104A-Filling-in-your-deputy-report-form-health-and-welfare-decisions.pdf,PDF,GOV.UK,NA,300,NA,NULL,N/A,#VALUE!,NA,NA,1,0,No,NA
2343,537796,Deputy annual report: accounting for your actions,OPG,Form,English,NA,OPG105-Professional-fees-insert.pdf,PDF,GOV.UK,NA,1440,NA,NULL,#N/A,#N/A,NA,NA,1,0,No,NA
2344,537798,Deputy annual report: accounting for your actions,OPG,Form,English,NA,OPG106-Public-authority-deputy-fees-insert.pdf,PDF,GOV.UK,NA,660,NA,NULL,#N/A,#N/A,NA,NA,1,0,No,NA
2352,601084,Deputy fees: remission or exemption,OPG,Form,English,NA,OPG120-Deputy-fees.pdf,PDF,GOV.UK,NA,768,NA,NULL,#N/A,#N/A,NA,NA,1,0,Yes,NA
2356,601101,Ffïoedd Dirprwy: dilead neu esemptiad,OPG,Form,English,NA,OPG120-Ffioedd-Dirprwyaethau.pdf,PDF,GOV.UK,NA,12,NA,NULL,#N/A,#N/A,NA,NA,1,1,Yes,NA
91,PA1,Ffurflen Gais Profiant / Probate application form,HMCTS,Form,Welsh,04/2011,pa1-bil.pdf,PDF,Formfinder,Probate,3,3,"c(""pa2"", ""b1"", ""c1"", ""a4"", ""c7"", ""d11"", ""c5"", ""pa3"", ""pa4"", ""c8"", ""pa1a"")",2238,7,7,10,1,0,Yes,0
189,PA1,Probate application,HMCTS,Form,English,04/2017,pa1-eng.pdf,PDF,Formfinder,Probate,135293,119505,"c(""pa2"", ""a4"", ""pa3"", ""no.65"", ""pa4"")",3212,10,4,10,1,0,Yes,0
8,PA10,Sut i gychwyn chwiliad sefydlog. Arweiniad i bobl sydd eisiau gwybod am ystad rhywun sydd wedi marw'n ddiweddar.,HMCTS,Guidance,Welsh,02/2012,pa10-cym.pdf,PDF,Formfinder,Profiant,#N/A,#N/A,"c(""pa5"", ""pa8"", ""pa9"", ""pa2"", ""pa6"", ""pa1s"", ""pa7a"", ""pa8a"", ""pa1"", ""pa7"", ""pa3"", ""pa1t"", ""pa4"", ""pa1a"")",N/A,#VALUE!,14,9,0,0,No,0
1679,PA1A,Nodiadau canllaw ar gyfer y Ffurflen Gais am Brofiant PA1 / Guidance Notes for Probate Application Form PA1,HMCTS,Guidance,Welsh,12/2008,pa1a-bil.pdf,PDF,Formfinder,Probate,2,2,none detected,N/A,#VALUE!,0,10,0,0,No,0
1681,PA1S,Cais am chwiliad profiant (copiau o grantiau ac ewyllysiau) / Application for a probate search (copies of grants and wills),HMCTS,Form,Welsh,04/2014,pa1s-bil.pdf,PDF,Formfinder,Probate,#N/A,#N/A,none detected,1406,5,0,13,0,0,Yes,0
1680,PA1S,Postal search of the Probate records of England and Wales,HMCTS,Form,English,03/2016,pa1s-eng.pdf,PDF,Formfinder,Probate,8625,7745,none detected,731,3,0,13,0,0,Yes,0
1682,PA1T,Cais am chwiliad sefydlog / Application for a standing search,HMCTS,Form,Welsh,02/2012,pa1t-bil.pdf,PDF,Formfinder,Probate,#N/A,#N/A,none detected,427,2,0,2,0,0,No,0
16,PA2,Sut i gael profiant - Canllaw i bobl sy'n gweithredu heb gyfreithiwr,HMCTS,Guidance,Welsh,08/2014,pa2-cym.pdf,PDF,Formfinder,Profiant,3,3,"c(""pa10"", ""pa8"", ""pa9"", ""pa1s"", ""pa7a"", ""pa8a"", ""pa1"", ""pa7"", ""pa3"", ""pa1t"", ""pa4"", ""pa1a"")",N/A,#VALUE!,12,10,0,0,Yes,0
22,PA2,"How to obtain probate, a guide for people acting without a solicitor",HMCTS,Leaflet,English,03/2017,pa2-eng.pdf,PDF,Formfinder,Probate,53022,48853,"c(""pa10"", ""pa8"", ""pa9"", ""pa1s"", ""pa7a"", ""pa8a"", ""pa1"", ""pa7"", ""pa3"", ""pa97"", ""pa4"")",N/A,#VALUE!,11,10,1,0,Yes,0
1683,PA3,Ffioedd Profiant o fis Ebrill 2011 ymlaen / Probate Fees from April 2011,HMCTS,Leaflet,Welsh,04/2011,pa3-bil.pdf,PDF,Formfinder,Probate,3,3,none detected,N/A,#VALUE!,0,10,0,0,No,0
420,PA3,Probate fees (from April 2014),HMCTS,Leaflet,English,04/2017,pa3-eng.pdf,PDF,Formfinder,Fees and Help with Fees,43549,40723,"c(""pa1"", ""ex160a"")",N/A,#VALUE!,2,10,0,0,No,0
657,PA4,Cyfeiriadur Cofrestrfeydd Profiant a Chanolfannau Apwyntiadau / Directory of Probate Registries and Appointment Venues,HMCTS,Leaflet,Welsh,09/2014,pa4-bil.pdf,PDF,Formfinder,Probate,4,4,pa2,N/A,#VALUE!,1,13,0,0,No,0
1684,PA4,Directory of Probate Registries and appointment venues,HMCTS,Leaflet,English,05/2017,pa4-eng.pdf,PDF,Formfinder,Probate,32696,30642,none detected,N/A,#VALUE!,0,13,0,0,No,0
9,PA5,A oes angen grant cynrychiolaeth arnaf (profiant neu lythyrau gweinyddu)? Arweiniad i bobl sy'n delio a'r ystad pan fo rhywun wedi marw'n ddiweddar.,HMCTS,Guidance,Welsh,04/2011,pa5-cym.pdf,PDF,Formfinder,Profiant,#N/A,#N/A,"c(""pa10"", ""pa8"", ""pa9"", ""pa2"", ""pa6"", ""pa1s"", ""pa7a"", ""pa8a"", ""pa1"", ""pa7"", ""pa3"", ""pa4"", ""pa1a"")",N/A,#VALUE!,13,6,0,0,No,0
17,PA5,Do I need a Grant of Representation (Probate or Letters of Administration)? A guide for people dealing with the estate when someone has recently died,HMCTS,Leaflet,English,04/2011,pa5-eng.pdf,PDF,Formfinder,Probate,21720,20422,"c(""pa10"", ""pa8"", ""pa9"", ""pa2"", ""pa6"", ""pa1s"", ""pa7a"", ""pa8a"", ""pa7"", ""pa3"", ""pa4"", ""pa1a"")",N/A,#VALUE!,12,6,0,0,No,0
44,PA6,Beth fydd yn digwydd yn fy nghyfweliad profiant?,HMCTS,Leaflet,Welsh,08/2011,pa6-cym.pdf,PDF,Formfinder,Profiant,#N/A,#N/A,"c(""pa10"", ""pa5"", ""pa8"", ""pa9"", ""pa1s"", ""pa7a"", ""pa8a"", ""pa7"", ""pa4"")",N/A,#VALUE!,9,7,0,0,No,0
10,PA7,Sut i adneuo ewyllys gyda'r Gwasanaeth Profiant. Arweiniad i bobl sydd am adneuo ewyllys i fod dan ofal sicr.,HMCTS,Guidance,Welsh,04/2011,pa7-cym.pdf,PDF,Formfinder,Profiant,1,1,"c(""pa10"", ""pa5"", ""pa8"", ""pa9"", ""pa2"", ""pa6"", ""pa1s"", ""pa7a"", ""pa8a"", ""pa1"", ""pa3"", ""pa4"", ""pa1a"")",N/A,#VALUE!,13,9,0,0,No,0
18,PA7,"How to deposit a will with the Probate Service, a guide for people who want to deposit a will for safekeeping",HMCTS,Guidance,English,04/2011,pa7-eng.pdf,PDF,Formfinder,Probate,3967,3814,"c(""pa10"", ""pa5"", ""pa8"", ""pa9"", ""pa2"", ""pa6"", ""pa1s"", ""pa7a"", ""pa8a"", ""pa3"", ""pa4"", ""pa1a"")",N/A,#VALUE!,12,9,1,0,No,0
1685,PA7A,Application to withdraw documents from safekeeping,HMCTS,Form,English,01/2009,pa7a-eng.pdf,PDF,Formfinder,Family,294,259,none detected,341,2,0,11,1,0,Yes,0
11,PA8,Sut i gofnodi cafeat. Arweiniad i bobl sydd am herio cais am grant ar ystad.,HMCTS,Guidance,Welsh,04/2011,pa8-cym.pdf,PDF,Formfinder,Profiant,#N/A,#N/A,"c(""pa10"", ""pa5"", ""pa9"", ""pa2"", ""pa6"", ""pa1s"", ""pa7a"", ""pa8a"", ""pa1"", ""pa7"", ""pa3"", ""pa4"", ""pa1a"")",N/A,#VALUE!,13,9,0,0,No,0
27,PA8,"How to enter a caveat, a guide for people who want to challenge an application for grant on an estate",HMCTS,Leaflet,English,04/2011,pa8-eng.pdf,PDF,Formfinder,Probate,2786,2641,"c(""pa10"", ""pa9"", ""pa2"", ""pa1s"", ""pa7a"", ""pa8a"", ""pa7"", ""pa3"", ""pa4"", ""pa1a"")",N/A,#VALUE!,10,9,0,0,No,0
1686,PA8A,Caveat application form,HMCTS,Form,English,03/2017,pa8a-eng.pdf,PDF,Formfinder,Family,4211,3717,none detected,216,1,0,11,1,0,No,0
12,PA9,Sut i gychwyn chwiliad cyffredinol,HMCTS,Leaflet,Welsh,04/2011,pa9-cym.pdf,PDF,Formfinder,Profiant,#N/A,#N/A,"c(""pa10"", ""pa5"", ""pa8"", ""pa2"", ""pa6"", ""pa1s"", ""pa7a"", ""pa8a"", ""pa1"", ""pa7"", ""pa3"", ""pa4"", ""pa1a"")",N/A,#VALUE!,13,0,0,0,No,0
422,PA97,Hysbysiad i geisydd personol / Notice to personal applicant,HMCTS,Leaflet,Welsh,08/2014,pa97-bil.doc,DOC,Formfinder,Probate,1,1,"c(""pa1s"", ""pa1"", ""c4"")",N/A,#VALUE!,2,0,0,0,No,0
421,PA97,Notice to personal applicant,HMCTS,Leaflet,English,05/2014,pa97-eng.doc,DOC,Formfinder,Probate,16820,12981,"c(""pa1s"", ""pa1"", ""c4"")",N/A,#VALUE!,2,0,0,0,No,0
658,PC001 (Birmingham),Request for an Adjournment (Birmingham),HMCTS,Form,English,09/2008,pc001-(birmingham)-eng.pdf,PDF,Formfinder,Planning Court,#N/A,#N/A,ex160,312,1,1,0,1,0,No,0
659,PC001 (Cardiff),Request for an Adjournment (Cardiff),HMCTS,Form,English,09/2008,pc001-(cardiff)-eng.pdf,PDF,Formfinder,Planning Court,#N/A,#N/A,ex160,301,1,1,0,1,0,No,0
660,PC001 (Leeds),Request for an Adjournment (Leeds),HMCTS,Form,English,09/2008,pc001-(leeds)-eng.pdf,PDF,Formfinder,Planning Court,2,2,ex160,302,1,1,0,1,0,No,0
661,PC001 (London),Request for an Adjournment (London),HMCTS,Form,English,09/2008,pc001-(london)-eng.pdf,PDF,Formfinder,Planning Court,37,32,ex160,306,1,1,0,1,0,No,0
662,PC001 (Manchester),Request for an Adjournment (Manchester),HMCTS,Form,English,09/2008,pc001-(manchester)-eng.pdf,PDF,Formfinder,Planning Court,#N/A,#N/A,ex160,306,1,1,0,1,0,No,0
1687,PCMH,Gwrandawiad Pledio a Rheoli Achos. Holiadur I Adfocadau / Plea and Case Management Hearing,HMCTS,Form,Welsh,04/2010,pcmh-bil.doc,DOC,Formfinder,Young Witness,#N/A,#N/A,none detected,5944,19,0,0,1,0,No,0
1688,PCPF244,"Application notice (Part 23) in the High Court of Justice, Queens Bench Division, the Planning Court",HMCTS,Form,English,04/2014,pcpf244-eng.pdf,PDF,Formfinder,Planning Court,86,77,none detected,288,1,0,0,1,0,No,1
663,PF1,Application for time (rule 3.1(2)(a)) (other than an application to extend time for service of a claim form),HMCTS,Form,English,04/2016,pf1-eng.doc,DOC,Formfinder,Queen's Bench,22,20,n244,82,1,1,2,0,0,No,0
1689,PF10,Anonymity and prohibition of publication order,HMCTS,Form,English,04/2016,pf10-eng.doc,DOC,Formfinder,Queen's Bench,30,24,none detected,581,2,0,0,0,0,No,0
1690,PF102,Bench Warrant,HMCTS,Form,English,04/2016,pf102-eng.doc,DOC,Formfinder,Queen's Bench,32,26,none detected,212,1,0,0,0,0,No,0
1691,PF103,Warrant of committal (general) (rule 81.30),HMCTS,Form,English,04/2016,pf103-eng.doc,DOC,Formfinder,Queen's Bench,71,60,none detected,146,1,0,0,0,0,No,0
1692,PF104,Warrant of committal (contempt in face of court) (rules 81.16 and 81.30),HMCTS,Form,English,04/2016,pf104-eng.doc,DOC,Formfinder,Queen's Bench,45,39,none detected,156,1,0,0,0,0,No,0
1693,PF105,Bench Warrant (Failure of witness to attend),HMCTS,Form,English,04/2016,pf105-eng.doc,DOC,Formfinder,Queen's Bench,9,9,none detected,217,1,0,0,0,0,No,0
1694,PF106,Warrant of committal {of prisoner) (rule 81.30),HMCTS,Form,English,04/2016,pf106-eng.doc,DOC,Formfinder,Queen's Bench,20,16,none detected,182,1,0,0,0,0,No,0
664,PF11,Application for Part 24 Judgment on the whole of a claim or on a particular issue (rule 24.2),HMCTS,Form,English,04/2016,pf11-eng.doc,DOC,Formfinder,Queen's Bench,33,28,n244,311,1,1,0,0,0,No,0
1695,PF113,"Evidence on application for service by an alternative method or at an alternative place (rules 6.15, 6.27 and PD6A paragraph 9)",HMCTS,Form,English,04/2016,pf113-eng.doc,DOC,Formfinder,Queen's Bench,25,16,none detected,343,2,0,0,1,0,No,0
