2159,464025,CW3: extension of upper cost limit in controlled work cases,LAA,Form,English,NA,cw3a-imm-Version-9-november-2015.pdf,PDF,GOV.UK,NA,672,NA,NULL,#N/A,#N/A,NA,NA,1,0,No,NA
2160,590362,CW3: extension of upper cost limit in controlled work cases,LAA,Form,English,NA,cw3b-electronic-form.xlsm,application/vnd.openxmlformats-officedocument.spreadsheetml.sheet,GOV.UK,NA,660,NA,NULL,#N/A,#N/A,NA,NA,1,0,Yes,NA
2157,418877,CW3: extension of upper cost limit in controlled work cases,LAA,Form,English,NA,cw3b-imm-version-8-april-2015.pdf,PDF,GOV.UK,NA,1956,NA,NULL,#N/A,#N/A,NA,NA,1,0,No,NA
2161,571658,CW3: extension of upper cost limit in controlled work cases,LAA,Guidance,English,NA,cw3c-checklist.pdf,PDF,GOV.UK,NA,240,NA,NULL,N/A,#VALUE!,NA,NA,1,0,No,NA
2226,571658,"CW2 (IMM) for representation, disbursement limit extension (CW3C), review of refusal (CW4): immigration forms",LAA,Guidance,English,NA,cw3c-checklist.pdf,PDF,GOV.UK,NA,132,NA,NULL,N/A,#VALUE!,NA,NA,1,0,No,NA
2225,590329,"CW2 (IMM) for representation, disbursement limit extension (CW3C), review of refusal (CW4): immigration forms",LAA,Form,English,NA,cw3c-electronic-form.xlsm,application/vnd.openxmlformats-officedocument.spreadsheetml.sheet,GOV.UK,NA,552,NA,NULL,#N/A,#N/A,NA,NA,1,0,Yes,NA
2223,418887,"CW2 (IMM) for representation, disbursement limit extension (CW3C), review of refusal (CW4): immigration forms",LAA,Form,English,NA,cw3c-imm-version-8-april-2015.pdf,PDF,GOV.UK,NA,1764,NA,NULL,#N/A,#N/A,NA,NA,1,0,No,NA
2066,312244,Asiantaeth Cymorth Cyfreithiol: ffurflenni Cymraeg (Welsh forms),LAA,Form,Welsh,NA,cw5-fersiwn-3-ebrill-2013.pdf,PDF,GOV.UK,NA,84,NA,NULL,#N/A,#N/A,NA,NA,0,0,No,NA
2158,438921,CW3: extension of upper cost limit in controlled work cases,LAA,Form,English,NA,cwa3a-electronic-form.xlsm,application/vnd.openxmlformats-officedocument.spreadsheetml.sheet,GOV.UK,NA,744,NA,NULL,#N/A,#N/A,NA,NA,1,0,Yes,NA
349,D11,Rhybudd o gais / Application notice,HMCTS,Form,Welsh,06/2016,d11-bil.pdf,PDF,Formfinder,Divorce / Civil Partnership Dissolution,2,1,"c(""ex160"", ""ex50"")",2110,7,2,4,1,1,Yes,1
348,D11,Application notice,HMCTS,Form,English,06/2016,d11-eng.pdf,PDF,Formfinder,Divorce / Civil Partnership Dissolution,14093,12435,"c(""ex160"", ""ex50"")",1180,4,2,4,1,1,Yes,1
1078,D13B,Affidafid i gefnogi cais i hepgor cyflwyno'r ddeiseb ysgaru / diddymu / dirymu / ymwahaniad (cyfreithiol) i'r Atebydd / Affidavit in support of a request to dispense with service of the divorce / dissolution / nullity / (judicial) separation petition on the Respondent,HMCTS,Form,Welsh,04/2012,d13b-bil.pdf,PDF,Formfinder,Divorce / Civil Partnership Dissolution,#N/A,#N/A,none detected,2421,8,0,0,1,0,Yes,1
1077,D13B,Statement in support to dispense with service of the divorce dissolution nullity (judicial) separation petition on the Respondent,HMCTS,Form,English,04/2012,d13b-eng.pdf,PDF,Formfinder,Divorce / Civil Partnership Dissolution,2871,2590,none detected,1260,4,0,0,1,0,Yes,1
1080,D151,Cais i gofrestru gorchymyn cynhaliaeth mewn llys ynadon / Application for registration of a maintenance order in a magistrates' court,HMCTS,Form,Welsh,04/2011,d151-bil.pdf,PDF,Formfinder,Divorce / Civil Partnership Dissolution,#N/A,#N/A,none detected,634,2,0,0,1,0,No,0
1079,D151,Application for registration of a maintenance order in the family court,HMCTS,Form,English,11/2015,d151-eng.pdf,PDF,Formfinder,Family,316,220,none detected,317,1,0,0,1,0,No,0
1082,D180,Tystysgrif y cyfeirir ati yn Erthygl 33 Rheoliad y Cyngor (CE) Rhif 1347/2000 29 Mai 2000 sy'n ymwneud â dyfarniadau mewn materion priodasol / Certificate referred to in Article 33 of Council Regulation (EC) NO. 1347/2000 of 29 May 2000 concerning judgments in matrimonial matters,HMCTS,Form,Welsh,09/2001,d180-bil.pdf,PDF,Formfinder,Divorce / Civil Partnership Dissolution,#N/A,#N/A,none detected,243,1,0,0,1,0,No,0
1081,D180,Concerning judgments in matrimonial matters,HMCTS,Form,English,03/2005,d180-eng.pdf,PDF,Formfinder,Divorce / Civil Partnership Dissolution,2105,1704,none detected,0,0,0,0,0,0,No,0
103,D183,Ynglyn ag ysgariad / diddymiad,HMCTS,Leaflet,Welsh,04/2014,d183-cym.pdf,PDF,Formfinder,Ysgariad/Diddymu Partneriaeth Sifil,#N/A,#N/A,"c(""d184"", ""d191"", ""ex50"", ""cb7"", ""d192"", ""ex160a"")",N/A,#VALUE!,6,5,0,0,No,0
102,D183,About divorce / dissolution,HMCTS,Leaflet,English,04/2014,d183-eng.pdf,PDF,Formfinder,Divorce / Civil Partnership Dissolution,19771,17995,"c(""d184"", ""d191"", ""ex50"", ""cb7"", ""d192"", ""ex160a"")",N/A,#VALUE!,6,5,0,0,No,0
50,D184,Rydw i eisiau ysgariad / diddymiad - beth ddylwn i ei wneud?,HMCTS,Leaflet,Welsh,04/2014,d184-cym.pdf,PDF,Formfinder,Ysgariad/Diddymu Partneriaeth Sifil,#N/A,#N/A,"c(""d183"", ""d8"", ""d186"", ""ex50"", ""cb7"", ""d89"", ""ex160a"")",N/A,#VALUE!,8,4,0,0,No,0
49,D184,I Want to get a divorce / dissolution,HMCTS,Leaflet,English,04/2014,d184-eng.pdf,PDF,Formfinder,Divorce / Civil Partnership Dissolution,1477,1334,"c(""d183"", ""d8"", ""d186"", ""ex50"", ""cb7"", ""d89"", ""ex160a"")",N/A,#VALUE!,8,4,0,0,No,0
232,D185,Plant ac ysgariad a diddymiad,HMCTS,Leaflet,Welsh,04/2014,d185-cym.pdf,PDF,Formfinder,Ysgariad/Diddymu Partneriaeth Sifil,#N/A,#N/A,"c(""cb1"", ""d184"", ""d183"")",N/A,#VALUE!,3,0,0,0,No,0
231,D185,Children and divorce and dissolution,HMCTS,Leaflet,English,04/2014,d185-eng.pdf,PDF,Formfinder,Divorce / Civil Partnership Dissolution,175,170,"c(""cb1"", ""d184"", ""d183"")",N/A,#VALUE!,3,0,0,0,No,0
170,D186,Mae'r atebydd wedi ateb fy neiseb,HMCTS,Leaflet,Welsh,04/2014,d186-cym.pdf,PDF,Formfinder,Ysgariad/Diddymu Partneriaeth Sifil,#N/A,#N/A,"c(""d187"", ""cb7"", ""d84"")",N/A,#VALUE!,4,2,0,0,Yes,0
169,D186,The respondent has replied to my petition. What must I do?,HMCTS,Leaflet,English,04/2016,d186-eng.pdf,PDF,Formfinder,Divorce / Civil Partnership Dissolution,17042,14512,"c(""d187"", ""cb7"", ""d84"")",N/A,#VALUE!,4,2,1,0,Yes,1
75,D187,Mae gen i ddyfarniad nisi/gorchymyn amodol. Beth sydd rhaid i mi ei wneud nesaf?,HMCTS,Leaflet,Welsh,04/2014,d187-cym.pdf,PDF,Formfinder,Ysgariad/Diddymu Partneriaeth Sifil,#N/A,#N/A,"c(""ex50"", ""d36"", ""ex160a"")",N/A,#VALUE!,7,0,0,0,No,0
74,D187,I have a Decree Nisi / Conditional Order. What must i do next?,HMCTS,Leaflet,English,11/2015,d187-eng.pdf,PDF,Formfinder,Divorce / Civil Partnership Dissolution,11311,10272,"c(""ex160"", ""ex50"", ""d36"")",N/A,#VALUE!,7,0,0,0,No,1
350,D190,Rwyf eisiau gwneud cais am orchymyn ariannol,HMCTS,Leaflet,Welsh,08/2015,d190-cym.pdf,PDF,Formfinder,Ysgariad/Diddymu Partneriaeth Sifil,#N/A,#N/A,"c(""ex50"", ""ex160a"")",N/A,#VALUE!,2,7,0,0,No,0
104,D190,I Want to apply for a Financial Order,HMCTS,Leaflet,English,08/2015,d190-eng.pdf,PDF,Formfinder,Divorce / Civil Partnership Dissolution,10783,9965,"c(""form a"", ""ex50"", ""ex160a"", ""form e"", ""form h"")",N/A,#VALUE!,6,7,0,0,No,1
106,D191,Ynglyn a dirymiad,HMCTS,Leaflet,Welsh,04/2014,d191-cym.pdf,PDF,Formfinder,Ysgariad/Diddymu Partneriaeth Sifil,#N/A,#N/A,"c(""d184"", ""d190"", ""d8"", ""ex50"", ""cb7"", ""d8n"", ""ex160a"")",N/A,#VALUE!,6,5,0,0,No,0
105,D191,About annulment,HMCTS,Leaflet,English,04/2014,d191-eng.pdf,PDF,Formfinder,Divorce / Civil Partnership Dissolution,60,59,"c(""d184"", ""d190"", ""d8"", ""ex50"", ""cb7"", ""d8n"", ""ex160a"")",N/A,#VALUE!,6,5,0,0,No,0
1083,D192,Ynglyn a gorchmynion/dyfarniadau ymwahaniad (cyfreithiol).,HMCTS,Leaflet,Welsh,04/2014,d192-cym.pdf,PDF,Formfinder,Ysgariad/Diddymu Partneriaeth Sifil,#N/A,#N/A,d8,N/A,#VALUE!,0,3,0,0,No,0
233,D192,About (Judicial) separation decrees / orders,HMCTS,Leaflet,English,04/2014,d192-eng.pdf,PDF,Formfinder,Divorce / Civil Partnership Dissolution,91,85,"c(""d191"", ""d8"", ""ex50"", ""cb7"")",N/A,#VALUE!,3,3,0,0,No,0
171,D193,Ynghylch diddymu,HMCTS,Form,Welsh,08/2007,d193-cym.pdf,PDF,Formfinder,Ysgariad/Diddymu Partneriaeth Sifil,#N/A,#N/A,"c(""d195"", ""d508"", ""d194"", ""ex160a"")",1209,4,4,0,0,0,No,0
51,D194,Rydw i eisiau cael diddymiad - Beth ddylwn ei wneud?,HMCTS,Form,Welsh,08/2007,d194-cym.pdf,PDF,Formfinder,Ysgariad/Diddymu Partneriaeth Sifil,#N/A,#N/A,"c(""ex50"", ""d5"", ""d89"", ""d8a"", ""d508"", ""ex160a"")",1195,4,8,1,0,0,No,0
107,D195,Plant a diddymu,HMCTS,Form,Welsh,08/2007,d195-cym.pdf,PDF,Formfinder,Ysgariad/Diddymu Partneriaeth Sifil,#N/A,#N/A,"c(""ex50"", ""d5"", ""d8a"", ""d196"", ""d197"", ""ex160a"")",1380,5,6,3,0,0,No,0
76,D196,Ma'r atebydd wedi ateb fy neiseb,HMCTS,Form,Welsh,08/2007,d196-cym.pdf,PDF,Formfinder,Ysgariad/Diddymu Partneriaeth Sifil,#N/A,#N/A,"c(""d5"", ""d195"", ""d84"", ""d8a"", ""d197"")",1135,4,7,1,0,0,No,0
77,D197,Mae gen i orchymyn amodol,HMCTS,Form,Welsh,08/2007,d197-cym.pdf,PDF,Formfinder,Ysgariad/Diddymu Partneriaeth Sifil,#N/A,#N/A,"c(""ex50"", ""d195"", ""d36"", ""ex160a"")",859,3,7,1,0,0,No,0
1085,D20,Archwiliad meddygol:datganiad y partion a'r archwilydd / Medical examination:statement of parties and examiner,HMCTS,Form,Welsh,04/2012,d20-bil.pdf,PDF,Formfinder,Divorce / Civil Partnership Dissolution,#N/A,#N/A,none detected,39,1,0,1,0,0,No,0
1084,D20,Medical examination statement of parties and examiner,HMCTS,Form,English,04/2012,d20-eng.pdf,PDF,Formfinder,Divorce / Civil Partnership Dissolution,41,40,none detected,115,1,0,1,1,0,No,0
1087,D252,Hysbysiad cychwyn asesu bil costau / Notice of commencement of assessment of bill of costs,HMCTS,Form,Welsh,04/2011,d252-bil.pdf,PDF,Formfinder,Divorce / Civil Partnership Dissolution,#N/A,#N/A,none detected,651,2,0,0,1,0,Yes,0
1086,D252,Notice of commencement of assessment of bill of costs,HMCTS,Form,English,04/2011,d252-eng.pdf,PDF,Formfinder,Divorce / Civil Partnership Dissolution,187,176,none detected,328,1,0,0,1,0,Yes,0
1089,D254,Cais am Dystysgrif Costau Diffygdalu / Request for a Default Costs Certificate,HMCTS,Form,Welsh,04/2011,d254-bil.pdf,PDF,Formfinder,Divorce / Civil Partnership Dissolution,#N/A,#N/A,none detected,304,1,0,0,1,0,Yes,0
1088,D254,Request for a Default Costs Certificate,HMCTS,Form,English,04/2014,d254-eng.pdf,PDF,Formfinder,Divorce / Civil Partnership Dissolution,167,153,none detected,151,1,0,0,1,0,Yes,0
1091,D258,Cais am wrandawiad asesiad manwl (ffurflen gyffredinol) / Request for detailed assessment hearing (general form),HMCTS,Form,Welsh,04/2011,d258-bil.pdf,PDF,Formfinder,Divorce / Civil Partnership Dissolution,#N/A,#N/A,none detected,565,2,0,0,1,0,Yes,0
1090,D258,Request for detailed assessment hearing (general form),HMCTS,Form,English,04/2011,d258-eng.pdf,PDF,Formfinder,Divorce / Civil Partnership Dissolution,108,103,none detected,278,1,0,0,1,0,Yes,0
1093,D258A,Cais am asesiad manwl (Y Comisiwn Gwasanaethau Cyfreithiol/Cymorth Cyfreithiol yn unig) / Request for detailed assessment (Legal aid/Legal Services Commission only),HMCTS,Form,Welsh,04/2011,d258a-bil.pdf,PDF,Formfinder,Divorce / Civil Partnership Dissolution,#N/A,#N/A,none detected,535,2,0,0,1,0,Yes,0
1092,D258A,Request for detailed assessment (Legal aid/Legal Services Commission only),HMCTS,Form,English,11/2014,d258a-eng.pdf,PDF,Formfinder,Divorce / Civil Partnership Dissolution,166,142,none detected,255,1,0,0,1,0,Yes,0
1096,D258B,Cais am asesiad manwl (Costau'n daladwy o gronfa ar wahan i Gronfa'r Gwasanaeth Cyfreithiol Cymunedol) / Request for detailed assessment (Costs payable out of a fund other than the Community Legal Service Fund),HMCTS,Form,Welsh,04/2011,d258b-bil.pdf,PDF,Formfinder,Divorce / Civil Partnership Dissolution,#N/A,#N/A,none detected,428,2,0,0,1,0,Yes,0
1095,D258B,Cais am asesiad manwl (Costau'n daladwy o gronfa ar wahan i Gymorth Cyfreithiol Sifil),HMCTS,Form,Welsh,04/2013,d258b-cym.pdf,PDF,Formfinder,Ysgariad/Diddymu Partneriaeth Sifil,#N/A,#N/A,none detected,215,1,0,0,0,0,Yes,0
1094,D258B,Request for detailed assessment (Costs payable out of a fund other than the Community Legal Service Fund),HMCTS,Form,English,11/2014,d258b-eng.pdf,PDF,Formfinder,Divorce / Civil Partnership Dissolution,18,17,none detected,213,1,0,0,1,0,Yes,0
1098,D258C,Cais am wrandawiad asesu manwl yn unol a gorchymyn o dan Rhan III Deddf Cyfreithwyr 1974 / Request for detailed assessment hearing pursuant to an order under Part III of the Solicitors Act 1974,HMCTS,Form,Welsh,04/2011,d258c-bil.pdf,PDF,Formfinder,Divorce / Civil Partnership Dissolution,#N/A,#N/A,none detected,523,2,0,0,1,0,Yes,0
1097,D258C,Request for detailed assessment hearing pursuant to an order under Part III of the Solicitors Act 1974,HMCTS,Form,English,11/2014,d258c-eng.pdf,PDF,Formfinder,Divorce / Civil Partnership Dissolution,22,22,none detected,244,1,0,0,1,0,Yes,0
1100,D259,Hysbysiad o apêl yn erbyn asesiad manwl / Notice of Appeal against a detailed assessment,HMCTS,Form,Welsh,04/2011,d259-bil.pdf,PDF,Formfinder,Divorce / Civil Partnership Dissolution,#N/A,#N/A,none detected,578,2,0,0,1,0,Yes,0
1099,D259,Notice of Appeal against a detailed assessment,HMCTS,Form,English,11/2014,d259-eng.pdf,PDF,Formfinder,Divorce / Civil Partnership Dissolution,102,97,none detected,286,1,0,0,1,0,Yes,0
1102,D36,Hysbysiad o gais i wneud dyfarniad nisi yn absoliwt neu i wneud gorchymyn amodol yn derfynol / Notice of application for decree nisi to be made absolute or conditional order to be made final,HMCTS,Form,Welsh,11/2014,d36-bil.pdf,PDF,Formfinder,Divorce / Civil Partnership Dissolution,1,1,none detected,141,1,0,3,1,0,No,0
1101,D36,Notice of Application for Decree Nisi to be made absolute or conditional order to be made final,HMCTS,Form,English,11/2014,d36-eng.pdf,PDF,Formfinder,Divorce / Civil Partnership Dissolution,28769,25520,none detected,29,1,0,3,0,0,No,0
514,D440,Cais am chwiliad am Ddyfarniad Absoliwt Ysgariad,HMCTS,Leaflet,Welsh,08/2014,d440-cym.pdf,PDF,Formfinder,Ysgariad/Diddymu Partneriaeth Sifil,#N/A,#N/A,ex50,N/A,#VALUE!,1,0,0,0,No,0
513,D440,Request for Search for Divorce Decree Absolute,HMCTS,Leaflet,English,11/2014,d440-eng.pdf,PDF,Formfinder,Divorce / Civil Partnership Dissolution,2024,1710,ex50,N/A,#VALUE!,1,0,0,0,No,0
1104,D5,Hysbysiad I'w arnodi ar ddogfen a gyflwynir yn unol a rheol 6.14 / Notice to be indorsed on document served in accordance with rule 6.14,HMCTS,Form,Welsh,04/2011,d5-bil.pdf,PDF,Formfinder,Divorce / Civil Partnership Dissolution,#N/A,#N/A,none detected,212,1,0,11,0,0,No,0
1103,D5,Notice to be indorsed on document served in accordance with rule 6.14,HMCTS,Form,English,04/2011,d5-eng.pdf,PDF,Formfinder,Family,50,46,none detected,115,1,0,11,0,0,No,0
1106,D50,Hysbysiad o gais ar sail methu â darparu cynhaliaeth resymol neu ar gyfer newid cytundeb cynhaliaeth yn ystod oes y partion / Notice of application on ground of failure to provide reasonable maintenance or for alteration of maintenance agreement during parties' lifetime,HMCTS,Form,Welsh,04/2012,d50-bil.pdf,PDF,Formfinder,Divorce / Civil Partnership Dissolution,#N/A,#N/A,none detected,289,1,0,6,0,0,No,0
1105,D50,Notice of application under section 17 of the Married Women's Property Act 1882 section 66 of the Civil Partnership Act 2004,HMCTS,Form,English,11/2014,d50-eng.pdf,PDF,Formfinder,Divorce / Civil Partnership Dissolution,162,149,none detected,157,1,0,6,0,0,No,0
1107,D508,Deiseb Diddymiad / Dissolution Petition,HMCTS,Form,Welsh,08/2007,d508-bil.pdf,PDF,Formfinder,#N/A,#N/A,#N/A,NULL,#N/A,#N/A,0,2,0,0,No,0
1108,D508 Nodiadau / D508 Notes,Deiseb Diddymiad - Nodiadau Canllaw / Dissolution Petition Notes for Guidance,HMCTS,Guidance,Welsh,08/2007,d508-nodiadau-d508-notes-bil.pdf,PDF,Formfinder,#N/A,#N/A,#N/A,NULL,N/A,#VALUE!,0,0,0,0,No,0
1110,D50A,Rhybudd o achos a chydnabyddiad cyflwyno dan adran 17 Deddf Eiddo Gwragedd Priod 1882/adran 66 Deddf Partneriaeth Sifil 2004 / Notice of proceedings and acknowledgement of service under section 17 of the Married Women's Property Act 1882/section 66 of the Civil Partnership Act 2004,HMCTS,Form,Welsh,04/2012,d50a-bil.pdf,PDF,Formfinder,Divorce / Civil Partnership Dissolution,#N/A,#N/A,none detected,765,3,0,0,0,0,No,1
1109,D50A,Notice of proceedings acknowledgement of service under s17 of the Married Women's Property Act 1882 s66 of the Civil Partnership Act 2004,HMCTS,Form,English,04/2012,d50a-eng.pdf,PDF,Formfinder,Divorce / Civil Partnership Dissolution,242,216,none detected,470,2,0,0,1,0,No,0
1112,D50B,Cais dan adran 17 Deddf Eiddo Gwragedd Priod 1882/adran 66 Deddf Partneriaeth Sifil 2004 / Cais i drosglwyddo tenantiaeth dan Ddeddf Cyfraith Teulu 1996 / Application under section 17 of The Married Women's Property Act 1882/section 66 of the Civil Partnership Act 2004/Application to transfer a tenancy under The Family Law Act 1996,HMCTS,Form,Welsh,04/2012,d50b-bil.pdf,PDF,Formfinder,Divorce / Civil Partnership Dissolution,#N/A,#N/A,none detected,837,3,0,0,1,0,Yes,1
1111,D50B,Application under s17 of the Married Women's Property Act 1882 s66 of the Civil Partnership Act 2004 Application to transfer a property,HMCTS,Form,English,11/2014,d50b-eng.pdf,PDF,Formfinder,Divorce / Civil Partnership Dissolution,628,506,none detected,467,2,0,0,1,0,Yes,1
516,D50C,Cais ar sail methiant i ddarparu cynhaliaeth resymol / Application on ground of failure to provide reasonable maintenance,HMCTS,Form,Welsh,01/2014,d50c-bil.pdf,PDF,Formfinder,Divorce / Civil Partnership Dissolution,#N/A,#N/A,"c(""a1"", ""form a1"")",283,1,1,2,0,0,Yes,0
515,D50C,Application on ground of failure to provide reasonable maintenance,HMCTS,Form,English,11/2014,d50c-eng.pdf,PDF,Formfinder,Divorce / Civil Partnership Dissolution,119,109,"c(""a1"", ""form a1"")",184,1,1,2,0,0,Yes,0
518,D50D,Cais i newid cytundeb cynhaliaeth yn dilyn marwolaeth un o'r partion dan adran 36 Deddf Achosion Priodasol 1973/paragraff 73 Atodlen 5 Deddf Partneriaeth Sifil 2004 / Application for alteration of maintenance agreement after the death of one of the parties under section 36 of the Matrimonial Causes Act 1973/paragraph 73 to Schedule 5 to the Civil Partnership Act 2004,HMCTS,Form,Welsh,04/2012,d50d-bil.pdf,PDF,Formfinder,Divorce / Civil Partnership Dissolution,#N/A,#N/A,"c(""a1"", ""form a1"")",946,3,1,0,1,0,Yes,1
517,D50D,"Application for alteration of maintenance agreement after the death of one of the parties, under s36 of the Matrimonial Causes Act 1973",HMCTS,Form,English,11/2014,d50d-eng.pdf,PDF,Formfinder,Divorce / Civil Partnership Dissolution,22,22,"c(""a1"", ""form a1"")",639,2,1,0,1,0,Yes,1
1114,D50E,Cais am ganiatâd i wneud cais am gymorth ariannol ar ol ysgariad dramor ayb. dan adran 13 Deddf Achosion Priodasol a Theuluol 1984 / paragraff 4 Atodlen 7 Deddf Partneriaethau Sifil 2004 / Application for permission to apply for financial relief after an overseas divorce etc. under section 13 of the Matrimonial and Family Proceedings Act 1984 / paragraph 4 of Schedule 7 to the Civil Partnership Act 2004,HMCTS,Form,Welsh,04/2011,d50e-bil.pdf,PDF,Formfinder,Divorce / Civil Partnership Dissolution,#N/A,#N/A,none detected,350,2,0,0,0,0,Yes,0
1113,D50E,Application for permission to apply for financial relief after an overseas divorce etc. under section 13 of the Matrimonial and Family Proceedings Act 1984 / paragraph 4 of Schedule 7 to the Civil Partnership Act 2004,HMCTS,Form,English,11/2014,d50e-eng.pdf,PDF,Formfinder,Divorce / Civil Partnership Dissolution,109,97,none detected,88,1,0,0,0,0,Yes,0
1116,D50F,Cais am gymorth ariannol ar ol ysgariad dramor ayb. dan adran 12 Deddf Achosion Priodasol a Theuluol 1984 / Atodlen 7 Deddf Partneriaethau Sifil 2004 / Application for financial relief after an overseas divorce etc. under section 12 of the Matrimonial and Family Proceedings Act 1984 / Schedule 7 to the Civil Partnership Act 2004,HMCTS,Form,Welsh,04/2011,d50f-bil.pdf,PDF,Formfinder,Divorce / Civil Partnership Dissolution,#N/A,#N/A,none detected,14,1,0,2,0,0,No,0
1115,D50F,Application for financial relief after an overseas divorce etc. under section 12 of the Matrimonial and Family Proceedings Act 1984 / Schedule 7 to the Civil Partnership Act 2004,HMCTS,Form,English,11/2014,d50f-eng.pdf,PDF,Formfinder,Divorce / Civil Partnership Dissolution,107,98,none detected,6,1,0,2,0,0,No,0
1118,D50G,Cais i atal trafodyn a fwriedir i rwystro ceisiadau tebygol am gymorth ariannol / Application to prevent transaction intended to defeat prospective applications for financial relief,HMCTS,Form,Welsh,04/2012,d50g-bil.pdf,PDF,Formfinder,Divorce / Civil Partnership Dissolution,#N/A,#N/A,none detected,171,1,0,0,0,0,No,0
1117,D50G,Application to prevent transaction intended to defeat prospective applications for financial relief,HMCTS,Form,English,11/2014,d50g-eng.pdf,PDF,Formfinder,Divorce / Civil Partnership Dissolution,97,86,none detected,59,1,0,0,0,0,No,0
1120,D50H,Cais am newid cytundeb cynhaliaeth yn ystod oes y partion / Application for alteration of maintenance agreement during parties lifetime,HMCTS,Form,Welsh,01/2014,d50h-bil.pdf,PDF,Formfinder,Divorce / Civil Partnership Dissolution,#N/A,#N/A,none detected,721,3,0,2,0,0,No,0
1119,D50H,Application for alteration of maintenance agreement during parties lifetime,HMCTS,Form,English,11/2014,d50h-eng.pdf,PDF,Formfinder,Divorce / Civil Partnership Dissolution,99,91,none detected,362,2,0,2,0,0,No,0
1122,D50J,Cais am orchymyn yn atal osgoi dan adran 32L Deddf Cynnal Plant 1991 / Application for an order preventing avoidance under section 32L of the Child Support Act 1991,HMCTS,Form,Welsh,04/2011,d50j-bil.pdf,PDF,Formfinder,Divorce / Civil Partnership Dissolution,#N/A,#N/A,none detected,899,3,0,0,1,0,Yes,1
1121,D50J,Application for an order preventing avoidance under section 32L of the Child Support Act 1991,HMCTS,Form,English,11/2014,d50j-eng.pdf,PDF,Formfinder,Divorce / Civil Partnership Dissolution,42,39,none detected,524,2,0,0,1,0,Yes,1
1124,D50K,Hysbysiad o gais am Orfodaeth drwy ddull gorfodi a ystyrir yn briodol gan y llys Rheolau Trefniadaeth Teulu 2010 Rheol 33.3(2)(b) / Notice of Application for Enforcement by such method of enforcement as the court may consider appropriate Family Procedure Rules 2010 Rule 33.3(2)(b),HMCTS,Form,Welsh,06/2016,d50k-bil.pdf,PDF,Formfinder,Divorce / Civil Partnership Dissolution,#N/A,#N/A,none detected,894,3,0,2,1,1,Yes,1
1123,D50K,Notice of Application for Enforcement by such method of enforcement as the court may consider appropriate Family Procedure Rules 2010 Rule 33.3(2)(b),HMCTS,Form,English,06/2016,d50k-eng.pdf,PDF,Formfinder,Divorce / Civil Partnership Dissolution,817,675,none detected,510,2,0,2,1,1,Yes,1
1125,D580(F),Affidafid gan ddeisebydd i gefnogi deiseb i ddiddymu dan Adran 12(g) / Affidavit by petitioner in support of petition for annulment under Section 12(g),HMCTS,Form,Welsh,12/2005,d580(f)-bil.pdf,PDF,Formfinder,Divorce / Civil Partnership Dissolution,#N/A,#N/A,none detected,0,0,0,0,0,0,No,0
1127,D6,Datganiad cymodi / Statement of reconciliation,HMCTS,Form,Welsh,04/2011,d6-bil.pdf,PDF,Formfinder,Divorce / Civil Partnership Dissolution,2,1,none detected,182,1,0,2,1,0,No,0
1126,D6,Statement of reconciliation,HMCTS,Form,English,04/2011,d6-eng.pdf,PDF,Formfinder,Divorce / Civil Partnership Dissolution,2341,2185,none detected,77,1,0,2,1,0,No,0
1129,D62,Cais am godi gwys dyfarniad / Request for issue of judgment summons,HMCTS,Form,Welsh,04/2011,d62-bil.pdf,PDF,Formfinder,Divorce / Civil Partnership Dissolution,2,1,none detected,499,2,0,2,1,0,No,0
1128,D62,Request for issue of judgment summons,HMCTS,Form,English,11/2014,d62-eng.pdf,PDF,Formfinder,Divorce / Civil Partnership Dissolution,136,124,none detected,278,1,0,2,1,0,No,0
1131,D63,Gwys Dyfarniad Rheolau Achosion Teulu 7.4(5) / Judgement Summons Family Proceedings Rules 7.4(5),HMCTS,Form,Welsh,01/2003,d63-bil.pdf,PDF,Formfinder,Divorce / Civil Partnership Dissolution,#N/A,#N/A,none detected,3,1,0,0,0,0,No,0
1130,D63,Judgment summons,HMCTS,Form,English,04/2011,d63-eng.pdf,PDF,Formfinder,Family,150,133,none detected,243,1,0,0,0,0,No,0
519,D650,Notice of Application to vary or set aside a financial order (Form E calculator error),HMCTS,Form,English,01/2016,d650-eng.pdf,PDF,Formfinder,Divorce / Civil Partnership Dissolution,247,226,form e,138,1,1,0,0,0,No,0
520,D651,Notice of application to vary or set aside a financial remedy (Form E1 calculator error),HMCTS,Form,English,02/2016,d651-eng.pdf,PDF,Formfinder,Divorce / Civil Partnership Dissolution,94,87,form e1,75,1,1,0,0,0,No,0
1133,D70,Cais am ddatganiad am statws priodasol/partneriaeth sifil / Application for declaration of marital/civil partnership status,HMCTS,Form,Welsh,01/2014,d70-bil.pdf,PDF,Formfinder,Divorce / Civil Partnership Dissolution,#N/A,#N/A,none detected,1401,5,0,0,1,0,Yes,1
1132,D70,Application for declaration of marital/civil partnership status,HMCTS,Form,English,04/2014,d70-eng.pdf,PDF,Formfinder,Divorce / Civil Partnership Dissolution,179,157,none detected,805,3,0,0,1,0,Yes,1
109,D8,"Cais am ysgariad, diddymiad neu ymwahaniad (cyfreithiol) / Application for a divorce, dissolution or (judicial) separation",HMCTS,Form,Welsh,08/2017,d8-bil.pdf,PDF,Formfinder,Divorce / Civil Partnership Dissolution,4,3,"c(""ex160"", ""form a"", ""ex50"", ""d11"", ""c8"", ""ex160a"")",8466,26,6,15,1,1,Yes,1
108,D8,"Application for a divorce, dissolution or to apply for a (judicial) Separation Order",HMCTS,Form,English,08/2017,d8-eng.pdf,PDF,Formfinder,Divorce / Civil Partnership Dissolution,104001,90799,"c(""ex160"", ""form a"", ""ex50"", ""d11"", ""c8"", ""ex160a"")",4091,13,6,15,1,1,Yes,1
172,D8 Nodiadau / D8 Notes,Nodiadau canllaw ar gyfer llenwi deiseb ysgaru/diddymu/ymwahanu (cyfreithiol) / Supporting notes for guidance on completing a divorce/dissolution/(judicial) separation petition,HMCTS,Guidance,Welsh,04/2014,d8-nodiadau-d8-notes-bil.pdf,PDF,Formfinder,Divorce / Civil Partnership Dissolution,#N/A,#N/A,"c(""d183"", ""d190"", ""d8"", ""ex50"", ""d192"", ""c8"")",N/A,#VALUE!,4,0,0,0,Yes,1
1135,D80A,Datganiad i gefnogi ysgariad/ymwahaniad (cyfreithiol) - godineb / Statement in support of divorce/(judicial) separation - adultery,HMCTS,Form,Welsh,04/2014,d80a-bil.pdf,PDF,Formfinder,Divorce / Civil Partnership Dissolution,#N/A,#N/A,none detected,863,3,0,0,1,0,Yes,1
